id,conversation_id,created_at,date,time,timezone,user_id,username,name,place,tweet,mentions,urls,photos,replies_count,retweets_count,likes_count,hashtags,cashtags,link,retweet,quote_url,video,near,geo,source,user_rt_id,user_rt,retweet_id,reply_to,retweet_date,translate,trans_src,trans_dest
1248121567302823939,1247897152413523969,1586410345000,2020-04-08,22:32:25,PDT,490317997,michaelcfox2,Michael C. Fox,,Oh I’m sorry was that Nov??Dec?Tell us what month or day that was !The same day u were mocking it!,"['repmattgaetz', 'joelcomm', 'realdonaldtrump']",[],[],0,0,0,[],[],https://twitter.com/MichaelCFox2/status/1248121567302823939,False,,0,Washington DC,,,,,,"[{'user_id': '490317997', 'username': 'MichaelCFox2'}, {'user_id': '818948638890217473', 'username': 'RepMattGaetz'}, {'user_id': '6108862', 'username': 'joelcomm'}, {'user_id': '25073877', 'username': 'realDonaldTrump'}]",,,,
1248121508700004352,1248121208840822784,1586410331000,2020-04-08,22:32:11,PDT,1186846388056969217,jonahfurman,Jonah Furman,,"It was not a few bad apples flipping from Obama to Trump that got us here.

It was the 40 year ""fuck you"" from the Democratic Party to the working class of this country.",[],[],[],1,1,24,[],[],https://twitter.com/JonahFurman/status/1248121508700004352,False,,0,Washington DC,,,,,,"[{'user_id': '1186846388056969217', 'username': 'JonahFurman'}]",,,,
1248121475132993538,1248121475132993538,1586410323000,2020-04-08,22:32:03,PDT,13850422,cnnpolitics,CNN Politics,,Democratic super PAC turns up focus on President Trump's coronavirus response  https://cnn.it/2Xh3zaq  pic.twitter.com/PCHus3XwzJ,[],['https://cnn.it/2Xh3zaq'],['https://pbs.twimg.com/media/EVI33f7UcAAONgM.jpg'],29,43,150,[],[],https://twitter.com/CNNPolitics/status/1248121475132993538,False,,0,Washington DC,,,,,,"[{'user_id': '13850422', 'username': 'CNNPolitics'}]",,,,
1248121437665271812,1247699290576871429,1586410314000,2020-04-08,22:31:54,PDT,619145554,joeuchill,Joe Uchill,,"In 2016, Trump argued he would have won even more states if it wasn't for massive voter fraud. It seems likely that, no matter what the outcome, that narrative will still be there. 

But Wisconsin brings a new level of truthiness to equivalent left-wing arguments.",['pandasquare1'],[],[],0,0,0,[],[],https://twitter.com/JoeUchill/status/1248121437665271812,False,,0,Washington DC,,,,,,"[{'user_id': '619145554', 'username': 'JoeUchill'}, {'user_id': '870048229785706496', 'username': 'Pandasquare1'}]",,,,
1248121418967121921,1248121418967121921,1586410309000,2020-04-08,22:31:49,PDT,1221256891621433345,mcleftington,Vest is Best,,"Trump will do to Biden what Biden did to Tara Reade 

#NeverBidenNeverTrump",[],[],[],0,0,3,['#neverbidennevertrump'],[],https://twitter.com/mcleftington/status/1248121418967121921,False,,0,Washington DC,,,,,,"[{'user_id': '1221256891621433345', 'username': 'mcleftington'}]",,,,
1248121399836921856,1248121399836921856,1586410305000,2020-04-08,22:31:45,PDT,330220603,carrollbeyer,MeganAgain,,Trump says voting by mail is bad. US troops do it all the time | Task & Purpose  https://taskandpurpose.com/analysis/us-military-votes-absentee-no-fraud …,[],['https://taskandpurpose.com/analysis/us-military-votes-absentee-no-fraud'],[],0,0,0,[],[],https://twitter.com/Carrollbeyer/status/1248121399836921856,False,,0,Washington DC,,,,,,"[{'user_id': '330220603', 'username': 'Carrollbeyer'}]",,,,
1248121393121603584,1247908232695169026,1586410303000,2020-04-08,22:31:43,PDT,4203100334,calmb4astorm,Relentless Woman 🆘,,"If that is what your heart says to do, do right by your heart. The primary I voted with mine, I wanted Warren.  Now living through this pandemic. I have to listen to my head and that choice is between Biden and Trump. One that can lead us through and one that is fucking insane.","['kelley08011', 'schlaton', 'ecmclaughlin', 'msnbc']",[],[],0,0,0,[],[],https://twitter.com/calmb4astorm/status/1248121393121603584,False,,0,Washington DC,,,,,,"[{'user_id': '4203100334', 'username': 'calmb4astorm'}, {'user_id': '1161679434111471616', 'username': 'Kelley08011'}, {'user_id': '1242102543561502730', 'username': 'schlaton'}, {'user_id': '335060282', 'username': 'ECMcLaughlin'}, {'user_id': '2836421', 'username': 'MSNBC'}]",,,,
1248121310787637254,1248121310787637254,1586410284000,2020-04-08,22:31:24,PDT,975117811365359618,potusnetwork,Presidential News Network,,"COVID-19 rakes up racism in US, Trump says infections in African-Americans higher #Government #Whitehouse #POTUS  https://www.newkerala.com/news/2020/61411.htm …",[],['https://www.newkerala.com/news/2020/61411.htm'],[],0,0,0,"['#government', '#whitehouse', '#potus']",[],https://twitter.com/POTUSNetwork/status/1248121310787637254,False,,0,Washington DC,,,,,,"[{'user_id': '975117811365359618', 'username': 'POTUSNetwork'}]",,,,
1248121103643443201,1248031430027943941,1586410234000,2020-04-08,22:30:34,PDT,43694024,ibishblog,Hussein Ibish,,"Most of me knows you’re right. But there’s a little voice whispering, “what’s the point when you know he’s going to lie, dissemble, gaslight, preen and, when all else fails, insult you personally?” I can’t remember the last time a question to Trump was meaningfully useful to me.",['blakehounshell'],[],[],0,0,1,[],[],https://twitter.com/Ibishblog/status/1248121103643443201,False,,0,Washington DC,,,,,,"[{'user_id': '43694024', 'username': 'Ibishblog'}, {'user_id': '17243582', 'username': 'blakehounshell'}]",,,,
1248121035603365888,1247928555117383693,1586410218000,2020-04-08,22:30:18,PDT,1273821824,toxicaudri,ToxicAudri 🌹 🦺,,Aside from the fact that Trump will have nothing effective to attack him on? That it's not as united as it appears? That the pandemic response would send him over the edge? Take your pick of the issues that Bernie is better then Biden on.,"['ballsinmyass1', 'michael30604525', 'irwbutvibing', 'petergriffinacc', 'berniesanders', 'neekolul']",[],[],1,0,1,[],[],https://twitter.com/ToxicAudri/status/1248121035603365888,False,,0,Washington DC,,,,,,"[{'user_id': '1273821824', 'username': 'ToxicAudri'}, {'user_id': '1208212111060549635', 'username': 'ballsinmyass1'}, {'user_id': '1084977519865094144', 'username': 'Michael30604525'}, {'user_id': '1063595558936473600', 'username': 'iRWbutVibing'}, {'user_id': '1095785749834801152', 'username': 'PeterGriffinAcc'}, {'user_id': '216776631', 'username': 'BernieSanders'}, {'user_id': '919810650162970624', 'username': 'neekolul'}]",,,,
1248121029769277446,1248116895112400897,1586410217000,2020-04-08,22:30:17,PDT,880801071052062720,jameshasson20,James Hasson,,"No one is pretending you’re required to vote for Trump. So, with that said, I would love for a single member of the Lincoln Project to explain to me how affirmatively voting for a candidate who wants to use taxpayer dollars to fund abortions is truly “conservative.”",[],[],[],2,1,27,[],[],https://twitter.com/JamesHasson20/status/1248121029769277446,False,,0,Washington DC,,,,,,"[{'user_id': '880801071052062720', 'username': 'JamesHasson20'}]",,,,
1248120861216759808,1248120861216759808,1586410176000,2020-04-08,22:29:36,PDT,1237959392189972480,rjqcc5o5hsjueg4,Daily Mail Online,,"US spy agencies were tracking the rise of the novel coronavirus as early as November, weeks before that information was included in President Trump's daily intelligence briefing, a former US military official told CNN.  pic.twitter.com/0qKkT3FWQ2",[],[],['https://pbs.twimg.com/media/EVI3TYEU0AA6qs2.jpg'],0,1,0,[],[],https://twitter.com/RjQcc5o5HSjueG4/status/1248120861216759808,False,,0,Washington DC,,,,,,"[{'user_id': '1237959392189972480', 'username': 'RjQcc5o5HSjueG4'}]",,,,
1248120723685511168,1248110338723151874,1586410144000,2020-04-08,22:29:04,PDT,1031193996968648704,shelbelstinton1,shelbel,,Amen,"['robertj98986257', 'realdonaldtrump']",[],[],0,0,0,[],[],https://twitter.com/Shelbelstinton1/status/1248120723685511168,False,,0,Washington DC,,,,,,"[{'user_id': '1031193996968648704', 'username': 'Shelbelstinton1'}, {'user_id': '1042423725864345601', 'username': 'RobertJ98986257'}, {'user_id': '25073877', 'username': 'realDonaldTrump'}]",,,,
1248120599471325184,1247699290576871429,1586410114000,2020-04-08,22:28:34,PDT,619145554,joeuchill,Joe Uchill,,"I'm actually now increasingly worried in the other direction - If Trump wins an unlikely state, the shenanigans in the Wisconsin judicial election will make it harder for people on the left to accept those results.",['pandasquare1'],[],[],1,0,0,[],[],https://twitter.com/JoeUchill/status/1248120599471325184,False,,0,Washington DC,,,,,,"[{'user_id': '619145554', 'username': 'JoeUchill'}, {'user_id': '870048229785706496', 'username': 'Pandasquare1'}]",,,,
1248120420915720195,1248120420915720195,1586410071000,2020-04-08,22:27:51,PDT,490317997,michaelcfox2,Michael C. Fox,,"@IngrahamAngle @realDonaldTrump 
Birds of a feather!

 https://www.thedailybeast.com/bill-oreilly-says-those-dying-from-coronavirus-were-on-their-last-legs-anyway …","['ingrahamangle', 'realdonaldtrump']",['https://www.thedailybeast.com/bill-oreilly-says-those-dying-from-coronavirus-were-on-their-last-legs-anyway'],[],0,0,0,[],[],https://twitter.com/MichaelCFox2/status/1248120420915720195,False,,0,Washington DC,,,,,,"[{'user_id': '490317997', 'username': 'MichaelCFox2'}, {'user_id': '50769180', 'username': 'IngrahamAngle'}, {'user_id': '25073877', 'username': 'realDonaldTrump'}]",,,,
1248120369552265216,1248120369552265216,1586410059000,2020-04-08,22:27:39,PDT,18956073,dcexaminer,Washington Examiner,,How the Trump campaign keeps outmaneuvering Biden  https://washex.am/2XkS9SZ ,[],['https://washex.am/2XkS9SZ'],[],18,21,30,[],[],https://twitter.com/dcexaminer/status/1248120369552265216,False,,0,Washington DC,,,,,,"[{'user_id': '18956073', 'username': 'dcexaminer'}]",,,,
1248120356562292738,1248120356562292738,1586410056000,2020-04-08,22:27:36,PDT,822518858242134016,trumpcountdown0,The Trump Countdown,,Only 6874 hours (or less?) until the end of President Trump's first term! #ParklandStrong #LockHimUp #TrumpCountdown,[],[],[],0,0,0,"['#parklandstrong', '#lockhimup', '#trumpcountdown']",[],https://twitter.com/TrumpCountdown0/status/1248120356562292738,False,,0,Washington DC,,,,,,"[{'user_id': '822518858242134016', 'username': 'TrumpCountdown0'}]",,,,
1248120350124040194,1247928262036258816,1586410055000,2020-04-08,22:27:35,PDT,1559703943,calim1701,Susan Dietz 🇺🇸,,"Yes, Biden is disingenuous. He's also a fondler, a sniffer & rapidly slipping down the senile slope.

You do know should he win in Nov, he won't be running the US. It'll be his VP or some other unAmerican POS like Pelosi.","['ggreene09', 'scunny01', 'alhooper76', 'parscale', 'trumpwarroom', 'realdonaldtrump', 'gop']",[],[],0,0,0,[],[],https://twitter.com/Calim1701/status/1248120350124040194,False,,0,Washington DC,,,,,,"[{'user_id': '1559703943', 'username': 'Calim1701'}, {'user_id': '18693964', 'username': 'ggreene09'}, {'user_id': '816718952705458176', 'username': 'SCunny01'}, {'user_id': '33544123', 'username': 'alhooper76'}, {'user_id': '17685258', 'username': 'parscale'}, {'user_id': '1108472017144201216', 'username': 'TrumpWarRoom'}, {'user_id': '25073877', 'username': 'realDonaldTrump'}, {'user_id': '11134252', 'username': 'GOP'}]",,,,
1248120342528380928,1248120342528380928,1586410053000,2020-04-08,22:27:33,PDT,975117811365359618,potusnetwork,Presidential News Network,,"Stocks lose steam after Wall Street's rally, while oil rises ahead of Russia-OPEC meeting - CNN #Trump #POTUS #Political https://www.cnn.com/2020/04/08/investing/global-stocks/index.html …",[],['https://www.cnn.com/2020/04/08/investing/global-stocks/index.html'],[],0,0,0,"['#trump', '#potus', '#political']",[],https://twitter.com/POTUSNetwork/status/1248120342528380928,False,,0,Washington DC,,,,,,"[{'user_id': '975117811365359618', 'username': 'POTUSNetwork'}]",,,,
1248120298605592578,1248120298605592578,1586410042000,2020-04-08,22:27:22,PDT,1206085317926633472,claudialillybr1,Claudia Lillybridge,,Vote blue cant be worse than what we've had last 3 years nobody could be worse than trump  https://twitter.com/mmpadellan/status/1248022440892039169 …,[],['https://twitter.com/mmpadellan/status/1248022440892039169'],[],0,0,0,[],[],https://twitter.com/ClaudiaLillybr1/status/1248120298605592578,False,https://twitter.com/mmpadellan/status/1248022440892039169,0,Washington DC,,,,,,"[{'user_id': '1206085317926633472', 'username': 'ClaudiaLillybr1'}]",,,,
1248120239369252864,1247980802169868296,1586410028000,2020-04-08,22:27:08,PDT,3065926399,petalflipper,Leslie Hollinger,,"Hmm, maybe that's because Trump has been in politics for only 4 years?

If we give him another 4 years, he'll probably get 2 to 3 more picks to make us have a 7-2, conservative, partisan SCOTUS.","['morgvanny', 'queeninyeiiow']",[],[],0,0,0,[],[],https://twitter.com/petalflipper/status/1248120239369252864,False,,0,Washington DC,,,,,,"[{'user_id': '3065926399', 'username': 'petalflipper'}, {'user_id': '922446325', 'username': 'morgvanny'}, {'user_id': '1026549584963747846', 'username': 'QueenInYeIIow'}]",,,,
1248120212198772736,1248120212198772736,1586410022000,2020-04-08,22:27:02,PDT,1221256891621433345,mcleftington,Vest is Best,,"Both Joe Biden and Donald Trump prove, without a shadow of a doubt, that we do not live in a meritocracy 

#NeverBidenNeverTrump",[],[],[],1,0,3,['#neverbidennevertrump'],[],https://twitter.com/mcleftington/status/1248120212198772736,False,,0,Washington DC,,,,,,"[{'user_id': '1221256891621433345', 'username': 'mcleftington'}]",,,,
1248120184604254208,1248120184604254208,1586410015000,2020-04-08,22:26:55,PDT,4220034913,rangler2016,Proud American,,"We Will Do What’s Right 
@POTUS DOES THIS 4 US
@realDonaldTrump Donates ALL His Presidential Salary
2 Different Charities   (That R Real)   
Not #ClintonFoundationCrimesAgainstChildren
#InsuranceFile #DaWienerLaptop #FRAZZLEDRIP
#PIZZAGATEISREAL
#MilitaryTribunals
#GITMO https://twitter.com/elenochle/status/1248115750113382400 …","['potus', 'realdonaldtrump']",['https://twitter.com/elenochle/status/1248115750113382400'],[],0,0,0,"['#clintonfoundationcrimesagainstchildren', '#insurancefile', '#dawienerlaptop', '#frazzledrip', '#pizzagateisreal', '#militarytribunals', '#gitmo']",[],https://twitter.com/Rangler2016/status/1248120184604254208,False,https://twitter.com/elenochle/status/1248115750113382400,0,Washington DC,,,,,,"[{'user_id': '4220034913', 'username': 'Rangler2016'}, {'user_id': '822215679726100480', 'username': 'POTUS'}, {'user_id': '25073877', 'username': 'realDonaldTrump'}]",,,,
1248120182930903041,1247946441575649281,1586410015000,2020-04-08,22:26:55,PDT,566723036,chanceacochran,Chance,,Folks shouldn’t feel fine/safe with Biden or other neolibs. Minorities should be especially outraged that this is the choice. But false equivalence between Biden’s policies (even the real bad ones) and Trump’s ignores a pretty massive difference in harm to marginalized people.,"['nvgiser', 'htnevard', 'itsdansheehan']",[],[],0,0,0,[],[],https://twitter.com/ChanceACochran/status/1248120182930903041,False,,0,Washington DC,,,,,,"[{'user_id': '566723036', 'username': 'ChanceACochran'}, {'user_id': '373308694', 'username': 'nvgiser'}, {'user_id': '622209376', 'username': 'htnevard'}, {'user_id': '17110927', 'username': 'ItsDanSheehan'}]",,,,
1248120068518686721,1247586363567996930,1586409987000,2020-04-08,22:26:27,PDT,410506205,lemma2010,lemma foto,,"Trump needs to resign, not WHO’s DG.","['senmcsallyaz', 'tartchow']",[],[],0,0,0,[],[],https://twitter.com/lemma2010/status/1248120068518686721,False,,0,Washington DC,,,,,,"[{'user_id': '410506205', 'username': 'lemma2010'}, {'user_id': '2964949642', 'username': 'SenMcSallyAZ'}, {'user_id': '308461741', 'username': 'tArtcHow'}]",,,,
1248120035597418499,1150453619323363328,1586409980000,2020-04-08,22:26:20,PDT,726711254,taceresol,😩😂😳 𝐓𝐡𝐞 𝐓𝐡𝐫𝐞𝐞 𝐅𝐚𝐜𝐞𝐬 𝐨𝐟 𝐈𝐯𝐲,,"Why? What makes him best, in your opinion? I'm genuinely asking you. What is it about this man, ignorant of government, lacking in critical thought and consistently proven to think only if his image and monetary worth that makes you believe he is ""the best president ever""?","['diamondandsilk', 'realdonaldtrump']",[],[],0,0,0,[],[],https://twitter.com/TacereSol/status/1248120035597418499,False,,0,Washington DC,,,,,,"[{'user_id': '726711254', 'username': 'TacereSol'}, {'user_id': '2908170952', 'username': 'DiamondandSilk'}, {'user_id': '25073877', 'username': 'realDonaldTrump'}]",,,,
1248119998033395714,1247341307678228481,1586409971000,2020-04-08,22:26:11,PDT,776875000473288704,larryjfeller3,Larry J Feller,,"Trump, even before this pandemic, put the government trillions of dollars in debt and even was spending a trillion dollars a year more than earned through revenue.

Like him or not, Clinton is the only President to operate like business establishing a $400 billion surplus.","['1040joyce', 'vabvox', 'lisadubbels', 'yashar']",[],[],0,0,0,[],[],https://twitter.com/LarryJFeller3/status/1248119998033395714,False,,0,Washington DC,,,,,,"[{'user_id': '776875000473288704', 'username': 'LarryJFeller3'}, {'user_id': '758809622819975168', 'username': '1040joyce'}, {'user_id': '138168339', 'username': 'VABVOX'}, {'user_id': '8917382', 'username': 'lisadubbels'}, {'user_id': '11744152', 'username': 'yashar'}]",,,,
1248119798711500804,1248119798711500804,1586409923000,2020-04-08,22:25:23,PDT,704882645507792896,itshaleighhh,hales,,A vote for no one or a write in is statistically as bad as a vote for trump but voting for Biden goes against every fiber of me as a human being. Pls help.,[],[],[],0,0,0,[],[],https://twitter.com/itshaleighhh/status/1248119798711500804,False,,0,Washington DC,,,,,,"[{'user_id': '704882645507792896', 'username': 'itshaleighhh'}]",,,,
1248119789681336322,1248119789681336322,1586409921000,2020-04-08,22:25:21,PDT,52965562,mikelotus,"Mike ""moo Nunes"" Confoy 🇺🇸 ≠ 🇷🇺",,George Conway’s Anti-Trump GOP Group Endorses Joe Biden For President  https://www.mediaite.com/news/anti-trump-gop-organization-endorses-joe-biden-after-sanders-drops-out/ …,[],['https://www.mediaite.com/news/anti-trump-gop-organization-endorses-joe-biden-after-sanders-drops-out/'],[],0,0,0,[],[],https://twitter.com/mikelotus/status/1248119789681336322,False,,0,Washington DC,,,,,,"[{'user_id': '52965562', 'username': 'mikelotus'}]",,,,
1248119736241664005,1248119736241664005,1586409908000,2020-04-08,22:25:08,PDT,52965562,mikelotus,"Mike ""moo Nunes"" Confoy 🇺🇸 ≠ 🇷🇺",,‘WHO IS THIS DUMBA**?’: NY Post Reporter Destroyed for Asking Trump Absurd Tiger King Question During Coronavirus Briefing  https://www.mediaite.com/trump/who-is-this-dumba-ny-post-reporter-destroyed-for-asking-trump-absurd-tiger-king-question-during-coronavirus-briefing/ …,[],['https://www.mediaite.com/trump/who-is-this-dumba-ny-post-reporter-destroyed-for-asking-trump-absurd-tiger-king-question-during-coronavirus-briefing/'],[],0,0,0,[],[],https://twitter.com/mikelotus/status/1248119736241664005,False,,0,Washington DC,,,,,,"[{'user_id': '52965562', 'username': 'mikelotus'}]",,,,
1248119716880830466,1247586363567996930,1586409904000,2020-04-08,22:25:04,PDT,410506205,lemma2010,lemma foto,,"Not WHO, it’s Trump’s lack of leadership and incompetence failed Americans. There’s blood on his hands. WHO informed USA, Taiwan, Singapore on the same day about the novel virus. Trump ignored the call continued to call it a Hoax. Now he blames WHO. Scapegoating? Trump’s failure","['senmcsallyaz', 'tartchow']",[],[],0,0,0,[],[],https://twitter.com/lemma2010/status/1248119716880830466,False,,0,Washington DC,,,,,,"[{'user_id': '410506205', 'username': 'lemma2010'}, {'user_id': '2964949642', 'username': 'SenMcSallyAZ'}, {'user_id': '308461741', 'username': 'tArtcHow'}]",,,,
1248119690876129280,1248119690876129280,1586409897000,2020-04-08,22:24:57,PDT,25202268,saracarterdc,Sara A. Carter,,"Barr disappointed by partisan attacks leveled at President Trump, says media on a 'jihad' against #hydroxychloroquine https://www.foxnews.com/media/ag-william-barr-disappointed-by-partisan-attacks-levied-at-president-trump-says-media-on-a-jihad-against-hydroxychloroquine …",[],['https://www.foxnews.com/media/ag-william-barr-disappointed-by-partisan-attacks-levied-at-president-trump-says-media-on-a-jihad-against-hydroxychloroquine'],[],45,543,1368,['#hydroxychloroquine'],[],https://twitter.com/SaraCarterDC/status/1248119690876129280,False,,0,Washington DC,,,,,,"[{'user_id': '25202268', 'username': 'SaraCarterDC'}]",,,,
1248119687302582274,1248119687302582274,1586409897000,2020-04-08,22:24:57,PDT,52965562,mikelotus,"Mike ""moo Nunes"" Confoy 🇺🇸 ≠ 🇷🇺",,"Trump Sets an Extremely Low Bar: If Number of Coronavirus Deaths are ‘Substantially’ Under 100,000, We’ve Done a ‘Good Job’  https://www.mediaite.com/news/trump-sets-an-extremely-low-bar-if-number-of-coronavirus-deaths-are-substantially-under-100000-weve-done-a-good-job/ …",[],['https://www.mediaite.com/news/trump-sets-an-extremely-low-bar-if-number-of-coronavirus-deaths-are-substantially-under-100000-weve-done-a-good-job/'],[],0,0,0,[],[],https://twitter.com/mikelotus/status/1248119687302582274,False,,0,Washington DC,,,,,,"[{'user_id': '52965562', 'username': 'mikelotus'}]",,,,
1248119520163758090,1248119520163758090,1586409857000,2020-04-08,22:24:17,PDT,52965562,mikelotus,"Mike ""moo Nunes"" Confoy 🇺🇸 ≠ 🇷🇺",,"AG Bill Barr Touts Hyrdoxychloroquine as ‘Very Promising,’ Claims Press Waging ‘Jihad’ Against Drug to Attack Trump  https://www.mediaite.com/news/ag-bill-barr-touts-hyrdoxychloroquine-as-very-promising-claims-press-waging-jihad-against-drug-to-attack-trump/ …",[],['https://www.mediaite.com/news/ag-bill-barr-touts-hyrdoxychloroquine-as-very-promising-claims-press-waging-jihad-against-drug-to-attack-trump/'],[],0,0,0,[],[],https://twitter.com/mikelotus/status/1248119520163758090,False,,0,Washington DC,,,,,,"[{'user_id': '52965562', 'username': 'mikelotus'}]",,,,
1248118996509089793,1248118996509089793,1586409732000,2020-04-08,22:22:12,PDT,52965562,mikelotus,"Mike ""moo Nunes"" Confoy 🇺🇸 ≠ 🇷🇺",,New Trump press secretary Kayleigh McEnany could do the impossible: Make us miss Sean Spicer  https://www.washingtonpost.com/lifestyle/media/before-kayleigh-mcenany-sean-spicer-set-a-dismal-tone-for-trump-press-secretaries-its-been-downhill-ever-since/2020/04/08/795fd890-79a3-11ea-9bee-c5bf9d2e3288_story.html …,[],['https://www.washingtonpost.com/lifestyle/media/before-kayleigh-mcenany-sean-spicer-set-a-dismal-tone-for-trump-press-secretaries-its-been-downhill-ever-since/2020/04/08/795fd890-79a3-11ea-9bee-c5bf9d2e3288_story.html'],[],0,0,0,[],[],https://twitter.com/mikelotus/status/1248118996509089793,False,,0,Washington DC,,,,,,"[{'user_id': '52965562', 'username': 'mikelotus'}]",,,,
1248118984651792384,1248118984651792384,1586409729000,2020-04-08,22:22:09,PDT,602113732,politics_n_beer,Brother Blood - Hiker,,If you hated Trump voters for ignoring sexual assault and voting him anyway......,[],[],[],0,0,0,[],[],https://twitter.com/Politics_n_Beer/status/1248118984651792384,False,,0,Washington DC,,,,,,"[{'user_id': '602113732', 'username': 'Politics_n_Beer'}]",,,,
1248118929131745280,1248101445796278272,1586409716000,2020-04-08,22:21:56,PDT,803801574,kevinmcgilly,Kevin McGilly,,"That’s ok, I don’t want to sleep with you either, I have a husband.
I do want to save the republic, which means voting for Biden. He wasn’t my 1st choice either. But I’m not a baby and I’m not taking my toys and going home. Do you want to wake up Nov 4 to a second Trump term?","['tomasitox_', 'drsagger', 'hail_g']",[],[],2,0,0,[],[],https://twitter.com/KevinMcGilly/status/1248118929131745280,False,,0,Washington DC,,,,,,"[{'user_id': '803801574', 'username': 'KevinMcGilly'}, {'user_id': '1226748787110092800', 'username': 'Tomasitox_'}, {'user_id': '955109400091426816', 'username': 'DrSagger'}, {'user_id': '586677593', 'username': 'hail_g'}]",,,,
1248118733056249858,1247861952736526336,1586409669000,2020-04-08,22:21:09,PDT,826268262698586112,lordvladimort,Pierre Derelicto,,"If you put an X next to the downballot option for democrats, it means you fully and completely denounce socialism in every race in your state.","['fotoguy01', 'sexcounseling', 'realdonaldtrump', 'foxandfriends']",[],[],0,0,0,[],[],https://twitter.com/LordVladimort/status/1248118733056249858,False,,0,Washington DC,,,,,,"[{'user_id': '826268262698586112', 'username': 'LordVladimort'}, {'user_id': '51958501', 'username': 'fotoguy01'}, {'user_id': '204444440', 'username': 'SexCounseling'}, {'user_id': '25073877', 'username': 'realDonaldTrump'}, {'user_id': '15513604', 'username': 'foxandfriends'}]",,,,
1248118648939692033,1247341307678228481,1586409649000,2020-04-08,22:20:49,PDT,776875000473288704,larryjfeller3,Larry J Feller,,"I doubt very seriously if you run your business anything like Trump does. Again, I doubt very seriously you run your business like Trump.

If you confirm that you do, then we really do have nothing further to discuss. Please do let me know.","['1040joyce', 'vabvox', 'lisadubbels', 'yashar']",[],[],0,0,0,[],[],https://twitter.com/LarryJFeller3/status/1248118648939692033,False,,0,Washington DC,,,,,,"[{'user_id': '776875000473288704', 'username': 'LarryJFeller3'}, {'user_id': '758809622819975168', 'username': '1040joyce'}, {'user_id': '138168339', 'username': 'VABVOX'}, {'user_id': '8917382', 'username': 'lisadubbels'}, {'user_id': '11744152', 'username': 'yashar'}]",,,,
