id,conversation_id,created_at,date,time,timezone,user_id,username,name,place,tweet,mentions,urls,photos,replies_count,retweets_count,likes_count,hashtags,cashtags,link,retweet,quote_url,video,near,geo,source,user_rt_id,user_rt,retweet_id,reply_to,retweet_date,translate,trans_src,trans_dest
1248133802603544578,1248126784274665472,1586413262000,2020-04-08,23:21:02,PDT,55125114,darockreaper,#GeneralStrike2020 | darockreaper,,"If I can make a serious case that Bernie only questioned his policy, not the rape accusations, not the Hunter Biden problems, not him lying about his civil rights record several times, how has this man been vetted? Biden is gonna get rolled vs Trump","['super_shazbot', 'emdstowers', 'briebriejoy']",[],[],0,0,0,[],[],https://twitter.com/darockreaper/status/1248133802603544578,False,,0,Washington DC,,,,,,"[{'user_id': '55125114', 'username': 'darockreaper'}, {'user_id': '1086799036563234816', 'username': 'Super_Shazbot'}, {'user_id': '803311702032850944', 'username': 'EmDStowers'}, {'user_id': '1332630685', 'username': 'briebriejoy'}]",,,,
1248133767983779840,1247904746750406656,1586413254000,2020-04-08,23:20:54,PDT,627845785,hystakes365,Dennis Jones,,"My honest opinion it's a part of Trump's team  reelection strategy, your convincing white folks it's a black problem, on top of that their poor so they are disposable, then you look at the states that are not on lockdown poor, rural, farmers, small towns, predominantly white
Then  pic.twitter.com/ES9coDqLKS",['dillardvicki'],[],[],0,0,0,[],[],https://twitter.com/hystakes365/status/1248133767983779840,False,,1,Washington DC,,,,,,"[{'user_id': '627845785', 'username': 'hystakes365'}, {'user_id': '718445586', 'username': 'DillardVicki'}]",,,,
1248133677747298305,1248133677747298305,1586413232000,2020-04-08,23:20:32,PDT,1222220916639166465,_lilpolitician,lil politician,,Some people need to be reminded of what Trump did.  https://twitter.com/funder/status/938433479192338432 …,[],['https://twitter.com/funder/status/938433479192338432'],[],0,0,0,[],[],https://twitter.com/_lilpolitician/status/1248133677747298305,False,https://twitter.com/funder/status/938433479192338432,0,Washington DC,,,,,,"[{'user_id': '1222220916639166465', 'username': '_lilpolitician'}]",,,,
1248133460579016705,1248133460579016705,1586413180000,2020-04-08,23:19:40,PDT,18956073,dcexaminer,Washington Examiner,,"""I don't know why President Obama hasn't supported Joe Biden a long time ago. He certainly doesn't want to see me for 4 more years. We think a little bit differently. 

He knows something that you don't know. I think I know, but you don't know."" – @realDonaldTrump  pic.twitter.com/lvBbGMOoQm",['realdonaldtrump'],[],[],2,1,2,[],[],https://twitter.com/dcexaminer/status/1248133460579016705,False,,1,Washington DC,,,,,,"[{'user_id': '18956073', 'username': 'dcexaminer'}, {'user_id': '25073877', 'username': 'realDonaldTrump'}]",,,,
1248133323324444673,1247874681232920581,1586413148000,2020-04-08,23:19:08,PDT,866858649737506817,richardpmpfx,Richard Malzahn,,"While I agree that Trump would undoubtedly love to become a fascist dictator for life, he doesn't refer to himself as a fascist.  Bernie, on the other hand, refers to himself as a socialist.

It's best to be honest about this kind of thing.","['breenewsome', 'moonwatcher1']",[],[],0,0,0,[],[],https://twitter.com/RichardPMPfx/status/1248133323324444673,False,,0,Washington DC,,,,,,"[{'user_id': '866858649737506817', 'username': 'RichardPMPfx'}, {'user_id': '110326494', 'username': 'BreeNewsome'}, {'user_id': '14101527', 'username': 'moonwatcher1'}]",,,,
1248133043639984133,1248133043639984133,1586413081000,2020-04-08,23:18:01,PDT,43694024,ibishblog,Hussein Ibish,,Trump would certain disdain him as a “total loser”  https://twitter.com/eliistender10/status/1248130554626793473 …,[],['https://twitter.com/eliistender10/status/1248130554626793473'],[],0,0,0,[],[],https://twitter.com/Ibishblog/status/1248133043639984133,False,https://twitter.com/eliistender10/status/1248130554626793473,0,Washington DC,,,,,,"[{'user_id': '43694024', 'username': 'Ibishblog'}]",,,,
1248132992775720961,1247863031687720963,1586413069000,2020-04-08,23:17:49,PDT,240939819,briankmcneal,B McNeal,,"NEW POLL: My left testicle would handle coronavirus better than Trump (it hangs slightly lower than the right, keeping me in touch with my surroundings).",['thehill'],[],[],0,0,0,[],[],https://twitter.com/Briankmcneal/status/1248132992775720961,False,,0,Washington DC,,,,,,"[{'user_id': '240939819', 'username': 'Briankmcneal'}, {'user_id': '1917731', 'username': 'thehill'}]",,,,
1248132906943254529,1247945901659893760,1586413048000,2020-04-08,23:17:28,PDT,1895332513,liconn54,❄️❄️ Liz Conner ❄️❄️,,"Surprise, surprise, surprise! A #BernieExtremist having a temper tantrum because his 1st choice dropped out due to no path to the nomination. Even Bernie knows Trump is the existential threat & plans to support the Dem nominee. Why can’t you figure it out?","['alaskanoutside', 'casarezkk']",[],[],0,0,0,['#bernieextremist'],[],https://twitter.com/Liconn54/status/1248132906943254529,False,,0,Washington DC,,,,,,"[{'user_id': '1895332513', 'username': 'Liconn54'}, {'user_id': '790744068699492352', 'username': 'AlaskanOutside'}, {'user_id': '1047142244128624642', 'username': 'CasarezKk'}]",,,,
1248132811229294592,1247949131424776193,1586413026000,2020-04-08,23:17:06,PDT,1169455352573616128,nwsteven83,Steve🏳️‍🌈🇺🇸,,"Wow you love a good conspiracy theory don't you? 😂 Should of known I was talking to a Nut. You wouldn't know reality if it smacked ya in that ignorant face of yours, would ya? Sorry ya'll lost again...I can see who you are really supporting. Just vote for Trump then. Be honest.","['france4senate', 'irvinewaylon', 'proudresister', 'briebriejoy', 'berniesanders']",[],[],1,0,0,[],[],https://twitter.com/NWSteven83/status/1248132811229294592,False,,0,Washington DC,,,,,,"[{'user_id': '1169455352573616128', 'username': 'NWSteven83'}, {'user_id': '1018805688858841088', 'username': 'France4Senate'}, {'user_id': '745245625789276160', 'username': 'IrvineWaylon'}, {'user_id': '755057897583804416', 'username': 'ProudResister'}, {'user_id': '1332630685', 'username': 'briebriejoy'}, {'user_id': '216776631', 'username': 'BernieSanders'}]",,,,
1248132512905170945,1248038163429425154,1586412954000,2020-04-08,23:15:54,PDT,2442142726,catchef71,Cathy~Deplorable🇺🇸❌,,"Lmfao! Biden doesn't even know where hes at or what day it is! Your TDS is so bad that you'd support someone with obvious dementia! Dont worry, Trump's going to win and our country will be safe from quidprojoe!","['itsdc2', 'thebradfordfile', 'joebiden']",[],[],0,0,0,[],[],https://twitter.com/catchef71/status/1248132512905170945,False,,0,Washington DC,,,,,,"[{'user_id': '2442142726', 'username': 'catchef71'}, {'user_id': '1084663031735422977', 'username': 'itsdc2'}, {'user_id': '3406938525', 'username': 'thebradfordfile'}, {'user_id': '939091', 'username': 'JoeBiden'}]",,,,
1248132340439830528,1248020003615457281,1586412913000,2020-04-08,23:15:13,PDT,316986307,craig_rasmussen,Left-handed Liberal,,Your wonder drug is already a failure . . . just like you! https://www.newsweek.com/hydroxychloroquine-coronavirus-france-heart-cardiac-1496810 …,['realdonaldtrump'],['https://www.newsweek.com/hydroxychloroquine-coronavirus-france-heart-cardiac-1496810'],[],0,0,0,[],[],https://twitter.com/Craig_Rasmussen/status/1248132340439830528,False,,0,Washington DC,,,,,,"[{'user_id': '316986307', 'username': 'Craig_Rasmussen'}, {'user_id': '25073877', 'username': 'realDonaldTrump'}]",,,,
1248132319598305280,1248130020847091712,1586412908000,2020-04-08,23:15:08,PDT,1121773986516557825,shrillandchill,claudia (let them) b,,"Ew, so weird. Even still- Trump is withholding WHO funding and trying to buy up vaccine companies so only American get it. She seems so much better in contrast.",['childfreediva'],[],[],1,0,1,[],[],https://twitter.com/shrillandchill/status/1248132319598305280,False,,0,Washington DC,,,,,,"[{'user_id': '1121773986516557825', 'username': 'shrillandchill'}, {'user_id': '115883210', 'username': 'childfreediva'}]",,,,
1248132283464159233,1247596351510196225,1586412900000,2020-04-08,23:15:00,PDT,361003801,aklers,❌Deplorable Ann❌,,We are seeing the corrupt DEMONRATS agenda right in our face,"['rconau', 'irenerusso124', 'jali_cat', 'abc', 'abcpolitics', 'realdonaldtrump', 'potus', 'vp']",[],[],0,0,0,[],[],https://twitter.com/Aklers/status/1248132283464159233,False,,0,Washington DC,,,,,,"[{'user_id': '361003801', 'username': 'Aklers'}, {'user_id': '1181648715016212483', 'username': 'RConau'}, {'user_id': '734566742052200449', 'username': 'irenerusso124'}, {'user_id': '1546656000', 'username': 'Jali_Cat'}, {'user_id': '28785486', 'username': 'ABC'}, {'user_id': '16815644', 'username': 'ABCPolitics'}, {'user_id': '25073877', 'username': 'realDonaldTrump'}, {'user_id': '822215679726100480', 'username': 'POTUS'}, {'user_id': '818910970567344128', 'username': 'VP'}]",,,,
1248132165730062336,1248031484532928514,1586412872000,2020-04-08,23:14:32,PDT,1838088222,andeenickee,Andrea Nicole,,"Yeah. Same thing, bruh.",['realdonaldtrump'],[],[],0,0,0,[],[],https://twitter.com/andeenickee/status/1248132165730062336,False,,0,Washington DC,,,,,,"[{'user_id': '1838088222', 'username': 'andeenickee'}, {'user_id': '25073877', 'username': 'realDonaldTrump'}]",,,,
1248131798783098880,1248131798783098880,1586412784000,2020-04-08,23:13:04,PDT,1112011786880983041,prestweets_,Presidential Tweets,,Trump questions. I not land and Members,[],[],[],0,0,0,[],[],https://twitter.com/prestweets_/status/1248131798783098880,False,,0,Washington DC,,,,,,"[{'user_id': '1112011786880983041', 'username': 'prestweets_'}]",,,,
1248131664469000192,1248131664469000192,1586412752000,2020-04-08,23:12:32,PDT,953629088203333632,fiinnislam,disabled girls for bernie,,yes vote blue no matter who but don’t fucking tell me to blindly vote bitch I’ll kill you. if Trump wasn’t the disgrace that he is I’d make you earn our vote.,[],[],[],0,0,0,[],[],https://twitter.com/fiinnislam/status/1248131664469000192,False,,0,Washington DC,,,,,,"[{'user_id': '953629088203333632', 'username': 'fiinnislam'}]",,,,
1248131654322880514,1248131654322880514,1586412750000,2020-04-08,23:12:30,PDT,826150510289883136,reaistevebannon,Steve Bannon,,"@realDonaldTrump You’re nothing without me behind you, Donald.",['realdonaldtrump'],[],[],0,0,0,[],[],https://twitter.com/reaISteveBannon/status/1248131654322880514,False,,0,Washington DC,,,,,,"[{'user_id': '826150510289883136', 'username': 'reaISteveBannon'}, {'user_id': '25073877', 'username': 'realDonaldTrump'}]",,,,
1248131548752347136,1248022496907059200,1586412725000,2020-04-08,23:12:05,PDT,316986307,craig_rasmussen,Left-handed Liberal,,"Your wonder drug is a failure . . . just like you!
 https://www.newsweek.com/hydroxychloroquine-coronavirus-france-heart-cardiac-1496810 …","['whitehouse', 'realdonaldtrump']",['https://www.newsweek.com/hydroxychloroquine-coronavirus-france-heart-cardiac-1496810'],[],0,0,0,[],[],https://twitter.com/Craig_Rasmussen/status/1248131548752347136,False,,0,Washington DC,,,,,,"[{'user_id': '316986307', 'username': 'Craig_Rasmussen'}, {'user_id': '822215673812119553', 'username': 'WhiteHouse'}, {'user_id': '25073877', 'username': 'realDonaldTrump'}]",,,,
1248131542091792384,1247666977566490626,1586412723000,2020-04-08,23:12:03,PDT,281673370,pariscandles,Margaret Rogers,,Yet Trump et al want to “open” the country back up in a matter of weeks. Result? Even many more unnecessary deaths. Insane.,['jburnmurdoch'],[],[],0,0,0,[],[],https://twitter.com/ParisCandles/status/1248131542091792384,False,,0,Washington DC,,,,,,"[{'user_id': '281673370', 'username': 'ParisCandles'}, {'user_id': '43878033', 'username': 'jburnmurdoch'}]",,,,
1248131316471812096,1247908643527409665,1586412669000,2020-04-08,23:11:09,PDT,827733665920737280,roguehistorian2,Rogue Historian,,We could have done that successfully if you hadn't lied to us and ignored the briefings that you received in January. #COVID #LiarInChief #BeBest,['realdonaldtrump'],[],[],0,0,0,"['#covid', '#liarinchief', '#bebest']",[],https://twitter.com/RogueHistorian2/status/1248131316471812096,False,,0,Washington DC,,,,,,"[{'user_id': '827733665920737280', 'username': 'RogueHistorian2'}, {'user_id': '25073877', 'username': 'realDonaldTrump'}]",,,,
1248131178491719681,1247950299408498693,1586412636000,2020-04-08,23:10:36,PDT,316986307,craig_rasmussen,Left-handed Liberal,,"It's not effective, bot! https://www.newsweek.com/hydroxychloroquine-coronavirus-france-heart-cardiac-1496810 …","['real_defender', 'realdonaldtrump', 'narendramodi']",['https://www.newsweek.com/hydroxychloroquine-coronavirus-france-heart-cardiac-1496810'],[],0,0,0,[],[],https://twitter.com/Craig_Rasmussen/status/1248131178491719681,False,,0,Washington DC,,,,,,"[{'user_id': '316986307', 'username': 'Craig_Rasmussen'}, {'user_id': '49034507', 'username': 'real_defender'}, {'user_id': '25073877', 'username': 'realDonaldTrump'}, {'user_id': '18839785', 'username': 'narendramodi'}]",,,,
1248131177971478529,1246256563800682497,1586412636000,2020-04-08,23:10:36,PDT,46270748,atomicigloo,atomicigloo,,"No you didn’t. It took you three tweets to even understand what I had said. You just saw that I said something about trump, didn’t even understand what it was I was saying and went in the attack. You have so much hate and ugliness in your heart. You need help.","['dbartoni69', 'bluetalonz', 'wontwearadress', 'palominopony', 'chelseaclinton']",[],[],1,0,0,[],[],https://twitter.com/atomicigloo/status/1248131177971478529,False,,0,Washington DC,,,,,,"[{'user_id': '46270748', 'username': 'atomicigloo'}, {'user_id': '2626353269', 'username': 'dbartoni69'}, {'user_id': '172060501', 'username': 'BlueTalonz'}, {'user_id': '752439026', 'username': 'wontwearadress'}, {'user_id': '138914345', 'username': 'PalominoPony'}, {'user_id': '757303975', 'username': 'ChelseaClinton'}]",,,,
1248130910404386819,1247950299408498693,1586412572000,2020-04-08,23:09:32,PDT,316986307,craig_rasmussen,Left-handed Liberal,,"Looks like your wonder drug doesn't work, Dummy!
 https://www.newsweek.com/hydroxychloroquine-coronavirus-france-heart-cardiac-1496810 …","['realdonaldtrump', 'narendramodi']",['https://www.newsweek.com/hydroxychloroquine-coronavirus-france-heart-cardiac-1496810'],[],0,0,0,[],[],https://twitter.com/Craig_Rasmussen/status/1248130910404386819,False,,0,Washington DC,,,,,,"[{'user_id': '316986307', 'username': 'Craig_Rasmussen'}, {'user_id': '25073877', 'username': 'realDonaldTrump'}, {'user_id': '18839785', 'username': 'narendramodi'}]",,,,
1248130796789129216,1248130796789129216,1586412545000,2020-04-08,23:09:05,PDT,594016621,rosspalombowplg,Ross Palombo,,Biden vs. Trump: General election battle is now set  https://www.local10.com/news/politics/2020/04/09/biden-vs-trump-general-election-battle-is-now-set/?utm_source=Twitter&utm_medium=social&utm_campaign=snd&utm_content=RossPalombo …,[],['https://www.local10.com/news/politics/2020/04/09/biden-vs-trump-general-election-battle-is-now-set/?utm_source=Twitter&utm_medium=social&utm_campaign=snd&utm_content=RossPalombo'],[],0,0,0,[],[],https://twitter.com/RossPalomboWPLG/status/1248130796789129216,False,,0,Washington DC,,,,,,"[{'user_id': '594016621', 'username': 'RossPalomboWPLG'}]",,,,
1248130724340928513,1248130724340928513,1586412528000,2020-04-08,23:08:48,PDT,16235283,johndesmarteau,John DesMarteau MD,,"""Bad"" hardly begins to describe the mistake some people on the left made in 2016 by either voting 3rd Party, not voting or even voting for Trump.  https://twitter.com/DanRiffle/status/1247963478591184898 …",[],['https://twitter.com/DanRiffle/status/1247963478591184898'],[],0,0,0,[],[],https://twitter.com/JohnDesMarteau/status/1248130724340928513,False,https://twitter.com/DanRiffle/status/1247963478591184898,0,Washington DC,,,,,,"[{'user_id': '16235283', 'username': 'JohnDesMarteau'}]",,,,
1248130588957126656,1247944917743276033,1586412496000,2020-04-08,23:08:16,PDT,284691765,tnick333,Tyler 🌐🏛♻️,,"Understood, although you’ll still vote for Joe? If not we get a scenario where progressive defectors vote for a third party (Jill Stein, 2016), not vote at all, or in some cases many populist Bernie supporters vote for Trump in anguish. It’s important to see this. @s_doncaster14","['lindsey_kelley_', 's_doncaster14']",[],[],0,0,0,[],[],https://twitter.com/Tnick333/status/1248130588957126656,False,,0,Washington DC,,,,,,"[{'user_id': '284691765', 'username': 'Tnick333'}, {'user_id': '255124329', 'username': 'Lindsey_Kelley_'}, {'user_id': '68799796', 'username': 's_doncaster14'}]",,,,
1248130585547005953,1247907610155720705,1586412495000,2020-04-08,23:08:15,PDT,361003801,aklers,❌Deplorable Ann❌,,"POTUS45 IS DOING WHAT WE THE PEOPLE VOTED HIM TO DO
VOTE RED AND KAG2020 AND GET OUR LIVES BACK","['kimguilfoyle', 'assyriangirll', 'realdonaldtrump']",[],[],0,0,0,[],[],https://twitter.com/Aklers/status/1248130585547005953,False,,0,Washington DC,,,,,,"[{'user_id': '361003801', 'username': 'Aklers'}, {'user_id': '25101996', 'username': 'kimguilfoyle'}, {'user_id': '53818115', 'username': 'Assyriangirll'}, {'user_id': '25073877', 'username': 'realDonaldTrump'}]",,,,
1248130507252121601,1247923936559419393,1586412476000,2020-04-08,23:07:56,PDT,17746424,vagueobject,Jaime Ravenet,,"Do you need more than ""vote against Trump in a way that doesn't give Trump a victory""? If so, maybe consider who your preferred candidates are going to be voting for.",['jichikawa'],[],[],0,0,0,[],[],https://twitter.com/VagueObject/status/1248130507252121601,False,,0,Washington DC,,,,,,"[{'user_id': '17746424', 'username': 'VagueObject'}, {'user_id': '15471002', 'username': 'jichikawa'}]",,,,
1248130295477436424,1248130295477436424,1586412426000,2020-04-08,23:07:06,PDT,2908566694,mgoodman20902,Margaret Goodman,,"An investigation into how poorly this pandemic was handled from the November warnings set to the IMPEACHED PRESIDENT Donald John Trump, without proper preparation, extensive TESTING, equipment and supplies stockpiled and DISTRIBUTION FULLFILLED thought the US! INVESTIGATE.  https://twitter.com/realdonaldtrump/status/1247900240155295745 …",[],['https://twitter.com/realdonaldtrump/status/1247900240155295745'],[],0,0,0,[],[],https://twitter.com/mgoodman20902/status/1248130295477436424,False,https://twitter.com/realDonaldTrump/status/1247900240155295745,0,Washington DC,,,,,,"[{'user_id': '2908566694', 'username': 'mgoodman20902'}]",,,,
1248130210668707841,1248130210668707841,1586412406000,2020-04-08,23:06:46,PDT,347568180,voastevenson,Jim Stevenson,,WHO rejects 'China-centric' charge after Trump criticism   https://reut.rs/2JM0hEa  @reuters,['reuters'],['https://reut.rs/2JM0hEa'],[],0,0,0,[],[],https://twitter.com/VOAStevenson/status/1248130210668707841,False,,0,Washington DC,,,,,,"[{'user_id': '347568180', 'username': 'VOAStevenson'}, {'user_id': '1652541', 'username': 'Reuters'}]",,,,
1248130020847091712,1248130020847091712,1586412360000,2020-04-08,23:06:00,PDT,1121773986516557825,shrillandchill,claudia (let them) b,,"I don't even know know her politics, she might be Norway's right wing, but she felt more comforting to me than Trump ever has. Anyone else get global leader jealousy? Especially in times like this.  https://twitter.com/thehill/status/1248128760521445378 …",[],['https://twitter.com/thehill/status/1248128760521445378'],[],2,0,2,[],[],https://twitter.com/shrillandchill/status/1248130020847091712,False,https://twitter.com/thehill/status/1248128760521445378,0,Washington DC,,,,,,"[{'user_id': '1121773986516557825', 'username': 'shrillandchill'}]",,,,
1248129939741655041,1247897589996908545,1586412341000,2020-04-08,23:05:41,PDT,361003801,aklers,❌Deplorable Ann❌,,WINNING,"['realdonaldtrump', 'liontedpride']",[],[],0,1,0,[],[],https://twitter.com/Aklers/status/1248129939741655041,False,,0,Washington DC,,,,,,"[{'user_id': '361003801', 'username': 'Aklers'}, {'user_id': '25073877', 'username': 'realDonaldTrump'}, {'user_id': '706289535383015424', 'username': 'LionTedPride'}]",,,,
1248129816416653317,1248129816416653317,1586412312000,2020-04-08,23:05:12,PDT,866064586235158532,antitrumpdebbie,Deb,,Trump plans on cutting federal funding for Coronavirus testing. Fewer tests equal fewer documented cases. Sounds like a plan to make Trump look good. Never mind more people will die. All that matters are the numbers. I mean the manipulated numbers.  https://twitter.com/atrupar/status/1248016552575651842 …,[],['https://twitter.com/atrupar/status/1248016552575651842'],[],0,0,0,[],[],https://twitter.com/antitrumpdebbie/status/1248129816416653317,False,https://twitter.com/atrupar/status/1248016552575651842,0,Washington DC,,,,,,"[{'user_id': '866064586235158532', 'username': 'antitrumpdebbie'}]",,,,
1248129760649187328,1248129760649187328,1586412298000,2020-04-08,23:04:58,PDT,627845785,hystakes365,Dennis Jones,,"Now let's also flip it🤔 not only Trump supporters what about Bernie supporters because things didn't go there way, no group of people suffered more than my people then/now and maybe 10% are saying they won't vote unless reparations are inn.We talk sista VP but no black agenda.  https://twitter.com/HannahDrake628/status/1247883679587692544 … pic.twitter.com/NOYLWhEeQk",[],['https://twitter.com/HannahDrake628/status/1247883679587692544'],[],0,0,0,[],[],https://twitter.com/hystakes365/status/1248129760649187328,False,,1,Washington DC,,,,,,"[{'user_id': '627845785', 'username': 'hystakes365'}]",,,,
1248129654600286209,1248129654600286209,1586412273000,2020-04-08,23:04:33,PDT,2529236736,alwaysme_84,Nicole #Impeach,,I can't in good conscience vote for Biden or for Trump #NeverBidenNeverTrump https://twitter.com/lockwoodx3/status/1246548990268780546 …,[],['https://twitter.com/lockwoodx3/status/1246548990268780546'],[],0,0,0,['#neverbidennevertrump'],[],https://twitter.com/AlwaysMe_84/status/1248129654600286209,False,https://twitter.com/lockwoodx3/status/1246548990268780546,0,Washington DC,,,,,,"[{'user_id': '2529236736', 'username': 'AlwaysMe_84'}]",,,,
1248129515580080128,1248046287032930310,1586412240000,2020-04-08,23:04:00,PDT,757780567999995905,newday_73,Newday,,"Alot of people either dont pay attention, vote like someone says is good, want free stuff, or vote Dem because they hate Trump. Sad but true.",['pocono_mtn'],[],[],0,0,1,[],[],https://twitter.com/Newday_73/status/1248129515580080128,False,,0,Washington DC,,,,,,"[{'user_id': '757780567999995905', 'username': 'Newday_73'}, {'user_id': '805541816024047616', 'username': 'pocono_mtn'}]",,,,
1248129336768512000,1248031484532928514,1586412197000,2020-04-08,23:03:17,PDT,245567280,vancemurphy,Vance Murphy,,"I know about 3 people that voted for Trump in the WA primary.. I wasn’t going to mark my envelope, so Jayapal, Murray and Inslee could stuff them.. god knows where.","['vmarks49', 'realdonaldtrump']",[],[],0,0,0,[],[],https://twitter.com/vancemurphy/status/1248129336768512000,False,,0,Washington DC,,,,,,"[{'user_id': '245567280', 'username': 'vancemurphy'}, {'user_id': '98034817', 'username': 'vmarks49'}, {'user_id': '25073877', 'username': 'realDonaldTrump'}]",,,,
1248129037052108801,1247914464319504385,1586412126000,2020-04-08,23:02:06,PDT,822736056487395331,othercarolb,The Other CarolB 💙,,I voted for Warren at the last minute but was a Biden supporter. Warren supporters did not become Bernie backers and that’s why he saw no path to win.,"['addiphotoman', 'proudresister', 'realdonaldtrump']",[],[],0,0,0,[],[],https://twitter.com/OtherCarolB/status/1248129037052108801,False,,0,Washington DC,,,,,,"[{'user_id': '822736056487395331', 'username': 'OtherCarolB'}, {'user_id': '573944824', 'username': 'Addiphotoman'}, {'user_id': '755057897583804416', 'username': 'ProudResister'}, {'user_id': '25073877', 'username': 'realDonaldTrump'}]",,,,
1248128927089848320,1248128927089848320,1586412099000,2020-04-08,23:01:39,PDT,74895176,ionghetie,Ion-Paul Ghetie,,Why exactly is Trump lashing out at the World Health Organization? - The Washington Post  https://www.washingtonpost.com/politics/2020/04/08/why-exactly-is-president-trump-lashing-out-world-health-organization/ …,[],['https://www.washingtonpost.com/politics/2020/04/08/why-exactly-is-president-trump-lashing-out-world-health-organization/'],[],0,0,0,[],[],https://twitter.com/IonGhetie/status/1248128927089848320,False,,0,Washington DC,,,,,,"[{'user_id': '74895176', 'username': 'IonGhetie'}]",,,,
1248128710630412288,1247930492286111746,1586412048000,2020-04-08,23:00:48,PDT,17670232,profchris,Christopher Chambers,,Your check from Russian trolls and trump is in the mail #Usefulidiots2020,"['coltonboettcher', 'jjohnsonlaw', 'mattyglesias', 'joebiden']",[],[],0,0,0,['#usefulidiots2020'],[],https://twitter.com/ProfChris/status/1248128710630412288,False,,0,Washington DC,,,,,,"[{'user_id': '17670232', 'username': 'ProfChris'}, {'user_id': '37987541', 'username': 'ColtonBoettcher'}, {'user_id': '386215505', 'username': 'JJohnsonLaw'}, {'user_id': '15446531', 'username': 'mattyglesias'}, {'user_id': '939091', 'username': 'JoeBiden'}]",,,,
1248128658998538241,1248128658998538241,1586412036000,2020-04-08,23:00:36,PDT,325470524,einobamanews,EIN Obama News,,Biden-Trump showdown looms after Sanders ends presidential bid  http://s.einnews.com/D_ueohqGuG ,[],['http://s.einnews.com/D_ueohqGuG'],[],0,0,0,[],[],https://twitter.com/EINObamaNews/status/1248128658998538241,False,,0,Washington DC,,,,,,"[{'user_id': '325470524', 'username': 'EINObamaNews'}]",,,,
