id,conversation_id,created_at,date,time,timezone,user_id,username,name,place,tweet,mentions,urls,photos,replies_count,retweets_count,likes_count,hashtags,cashtags,link,retweet,quote_url,video,near,geo,source,user_rt_id,user_rt,retweet_id,reply_to,retweet_date,translate,trans_src,trans_dest
1248098745058603009,1247964854784151552,1586404904000,2020-04-08,21:01:44,PDT,37698363,turbokia,PNW,,So tell me some media outlet you'll believe.,"['lizpowe08720708', 'cman2342', 'joeysalads', 'realdonaldtrump']",[],[],1,0,0,[],[],https://twitter.com/TurboKia/status/1248098745058603009,False,,0,Washington DC,,,,,,"[{'user_id': '37698363', 'username': 'TurboKia'}, {'user_id': '722953034788020224', 'username': 'Lizpowe08720708'}, {'user_id': '41646396', 'username': 'cman2342'}, {'user_id': '488998711', 'username': 'JoeySalads'}, {'user_id': '25073877', 'username': 'realDonaldTrump'}]",,,,
1248098666436575232,1247900240155295745,1586404885000,2020-04-08,21:01:25,PDT,849111026691956736,krislouwin,SkipToMyLou,,I thought this was the parody account. 🤦,['realdonaldtrump'],[],[],0,0,1,[],[],https://twitter.com/KrisLouWin/status/1248098666436575232,False,,0,Washington DC,,,,,,"[{'user_id': '849111026691956736', 'username': 'KrisLouWin'}, {'user_id': '25073877', 'username': 'realDonaldTrump'}]",,,,
1248098623776100358,1247927464971702273,1586404875000,2020-04-08,21:01:15,PDT,1273821824,toxicaudri,ToxicAudri 🌹 🦺,,They all like to forget that Trump was once a democrat supporter.,"['theciroth', 'scaryfoxx', 'toddappel', 'altrightdelete', 'mehdirhasan']",[],[],0,0,1,[],[],https://twitter.com/ToxicAudri/status/1248098623776100358,False,,0,Washington DC,,,,,,"[{'user_id': '1273821824', 'username': 'ToxicAudri'}, {'user_id': '2788196223', 'username': 'TheCiroth'}, {'user_id': '163665321', 'username': 'scaryfoxx'}, {'user_id': '21561212', 'username': 'ToddAppel'}, {'user_id': '769301162940137473', 'username': 'AltRightDelete'}, {'user_id': '130557513', 'username': 'mehdirhasan'}]",,,,
1248098614485934081,1248087007181418499,1586404872000,2020-04-08,21:01:12,PDT,994288838074884097,hardfloor74,Lying Dog-Faced My Lil Pony Souljah,,More than half. Don’t pretend Trump is Captain Coherent,"['gnossos5524', 'halfurman']",[],[],0,0,1,[],[],https://twitter.com/Hardfloor74/status/1248098614485934081,False,,0,Washington DC,,,,,,"[{'user_id': '994288838074884097', 'username': 'Hardfloor74'}, {'user_id': '159985353', 'username': 'gnossos5524'}, {'user_id': '372907147', 'username': 'HalFurman'}]",,,,
1248098612447346689,1247964854784151552,1586404872000,2020-04-08,21:01:12,PDT,37698363,turbokia,PNW,,"This is where voter fraud comes from ... Republicans

North Carolina Republican operative charged in election fraud scheme | Article [AMP] | Reuters https://mobile.reuters.com/article/amp/idUSKCN1QG2FS?__twitter_impression=true …","['lizpowe08720708', 'cman2342', 'joeysalads', 'realdonaldtrump']",['https://mobile.reuters.com/article/amp/idUSKCN1QG2FS?__twitter_impression=true'],[],1,0,0,[],[],https://twitter.com/TurboKia/status/1248098612447346689,False,,0,Washington DC,,,,,,"[{'user_id': '37698363', 'username': 'TurboKia'}, {'user_id': '722953034788020224', 'username': 'Lizpowe08720708'}, {'user_id': '41646396', 'username': 'cman2342'}, {'user_id': '488998711', 'username': 'JoeySalads'}, {'user_id': '25073877', 'username': 'realDonaldTrump'}]",,,,
1248098462408814595,1248098462408814595,1586404836000,2020-04-08,21:00:36,PDT,325470524,einobamanews,EIN Obama News,,Barack Obama Complains Again: Donald Trump Failing to Enact 'Robust' Coronavirus Testing  http://s.einnews.com/EoCbADHAkw ,[],['http://s.einnews.com/EoCbADHAkw'],[],0,0,0,[],[],https://twitter.com/EINObamaNews/status/1248098462408814595,False,,0,Washington DC,,,,,,"[{'user_id': '325470524', 'username': 'EINObamaNews'}]",,,,
1248098386282233857,1248094131123093505,1586404818000,2020-04-08,21:00:18,PDT,514888463,mdcollopy,Michael Collopy,,Oh I absolutely agree... I just hope people vote for Biden anyway bc the alternative is Trump getting another four years and a lot of people can’t afford that,['graceyesterday'],[],[],1,0,1,[],[],https://twitter.com/mdcollopy/status/1248098386282233857,False,,0,Washington DC,,,,,,"[{'user_id': '514888463', 'username': 'mdcollopy'}, {'user_id': '28260984', 'username': 'graceyesterday'}]",,,,
1248098373351010304,1247965415369617409,1586404815000,2020-04-08,21:00:15,PDT,322373878,treemunsh,Teresa Miller,,Whose fucking fault is that??? Do you want to defeat Trump or continue his reign?,"['ash_lestrange', 'rtzyi']",[],[],0,0,0,[],[],https://twitter.com/treemunsh/status/1248098373351010304,False,,0,Washington DC,,,,,,"[{'user_id': '322373878', 'username': 'treemunsh'}, {'user_id': '700745601294561280', 'username': 'Ash_Lestrange'}, {'user_id': '1002130828321837057', 'username': 'rtzyi'}]",,,,
1248098361439170560,1248098361439170560,1586404812000,2020-04-08,21:00:12,PDT,979415931947495426,rustyfairbanks,Rusty Fairbanks,,"Trump blew it — not the WHO, Fauci or the Jews  https://www.washingtonpost.com/opinions/2020/04/06/trump-blew-it-not-who-fauci-or-jews/ … The ""I'm not responsible"" who is responsible for that which is not American.",[],['https://www.washingtonpost.com/opinions/2020/04/06/trump-blew-it-not-who-fauci-or-jews/'],[],0,0,0,[],[],https://twitter.com/RustyFairbanks/status/1248098361439170560,False,,0,Washington DC,,,,,,"[{'user_id': '979415931947495426', 'username': 'RustyFairbanks'}]",,,,
1248098333173915648,1248098333173915648,1586404805000,2020-04-08,21:00:05,PDT,22187085,crewcrew,Citizens for Ethics,,"A pharma-funded group tied to a top Trump donor has been pushing Trump to approve the use of hydroxychloroquine. That raises big questions about industry influence, so we launched an investigation. 
 https://www.citizensforethics.org/foia/science-coronavirus-treatment/ …",[],['https://www.citizensforethics.org/foia/science-coronavirus-treatment/'],[],13,402,773,[],[],https://twitter.com/CREWcrew/status/1248098333173915648,False,,0,Washington DC,,,,,,"[{'user_id': '22187085', 'username': 'CREWcrew'}]",,,,
1248098320209281025,1248092890888384520,1586404802000,2020-04-08,21:00:02,PDT,41058961,dartemus,Daniel G. Blum 🇺🇸❤️🌟,,"Republicans are like deadbeat dads who treat the country's people like an unloved stepchild. They will give money to help people, but only as a last resort, and even then, only when absolutely forced to.","['colmorrisdavis', 'realdonaldtrump', 'senatemajldr']",[],[],0,0,0,[],[],https://twitter.com/Dartemus/status/1248098320209281025,False,,0,Washington DC,,,,,,"[{'user_id': '41058961', 'username': 'Dartemus'}, {'user_id': '489475164', 'username': 'ColMorrisDavis'}, {'user_id': '25073877', 'username': 'realDonaldTrump'}, {'user_id': '1249982359', 'username': 'senatemajldr'}]",,,,
1248098309861863426,1248098309861863426,1586404800000,2020-04-08,21:00:00,PDT,18247062,judicialwatch,Judicial Watch 🔎,,".@TomFitton: ""You don’t have self-govt if you don’t know what the government is up to. Judicial Watch has over 30 federal lawsuits on the targeting of @realDonaldTrump, the Deep State, Special Counsel Mueller, & other basic info requests that only Judicial Watch is fighting for.""  pic.twitter.com/6uXtK1gLBQ","['tomfitton', 'realdonaldtrump']",[],[],20,182,485,[],[],https://twitter.com/JudicialWatch/status/1248098309861863426,False,,1,Washington DC,,,,,,"[{'user_id': '18247062', 'username': 'JudicialWatch'}, {'user_id': '18266688', 'username': 'TomFitton'}, {'user_id': '25073877', 'username': 'realDonaldTrump'}]",,,,
1248098307366215680,1248098307366215680,1586404799000,2020-04-08,20:59:59,PDT,2176138431,cristobaljalex,Cristóbal Alex,,"Over a year ago I started on this journey to help elect our next president. I couldn’t have imagined the twists & turns. Seeing @JoeBiden up close-caring, brilliant, thoughtful- gives me great hope for our future. Ready for the next 208 days until we defeat Trump and elect Biden.  pic.twitter.com/AqPbNK06Fb",['joebiden'],[],['https://pbs.twimg.com/media/EVIiyizU8AAbOun.jpg'],3,21,137,[],[],https://twitter.com/CristobalJAlex/status/1248098307366215680,False,,0,Washington DC,,,,,,"[{'user_id': '2176138431', 'username': 'CristobalJAlex'}, {'user_id': '939091', 'username': 'JoeBiden'}]",,,,
1248098223211737088,1248031484532928514,1586404779000,2020-04-08,20:59:39,PDT,3018850448,32jim2,VOTE BY MAIL IS THE WAY TO GO,,Donny might think that an absentee ballot is what the Republican Governor of Georgia did to the Dems by making their voter registration invalid causing an absent of voting.,"['familyunequal', 'realdonaldtrump']",[],[],0,0,0,[],[],https://twitter.com/32jim2/status/1248098223211737088,False,,0,Washington DC,,,,,,"[{'user_id': '3018850448', 'username': '32jim2'}, {'user_id': '38047391', 'username': 'familyunequal'}, {'user_id': '25073877', 'username': 'realDonaldTrump'}]",,,,
1248098123966185473,1248098123966185473,1586404755000,2020-04-08,20:59:15,PDT,14167059,tylerpager,Tyler Pager,,Bernie Sanders deflects when asked by Stephen Colbert if he is endorsing Joe Biden. Says he is talking to him and his team but pivots to say that he will work to defeat Donald Trump.,[],[],[],3,5,10,[],[],https://twitter.com/tylerpager/status/1248098123966185473,False,,0,Washington DC,,,,,,"[{'user_id': '14167059', 'username': 'tylerpager'}]",,,,
1248098016017317890,1248098016017317890,1586404730000,2020-04-08,20:58:50,PDT,150407693,joebra123,Joe Brazda,,Lying and corrupt. #Trump got his Roy Cohn  https://twitter.com/brhodes/status/1248091560408805376 …,[],['https://twitter.com/brhodes/status/1248091560408805376'],[],0,0,1,['#trump'],[],https://twitter.com/JoeBra123/status/1248098016017317890,False,https://twitter.com/brhodes/status/1248091560408805376,0,Washington DC,,,,,,"[{'user_id': '150407693', 'username': 'JoeBra123'}]",,,,
1248097987911442432,1248097987911442432,1586404723000,2020-04-08,20:58:43,PDT,34041322,jonsteingart,Jon Steingart,,Obama OSHA chief doesn’t seem to like how Trump OSHA is handling Covid-19  https://twitter.com/drdavidmichaels/status/1248094284789747713 …,[],['https://twitter.com/drdavidmichaels/status/1248094284789747713'],[],0,3,2,[],[],https://twitter.com/jonsteingart/status/1248097987911442432,False,https://twitter.com/drdavidmichaels/status/1248094284789747713,0,Washington DC,,,,,,"[{'user_id': '34041322', 'username': 'jonsteingart'}]",,,,
1248097976398086144,1248097976398086144,1586404720000,2020-04-08,20:58:40,PDT,17170195,thisismash,Mash,,The Trump administration has done so much damage with the restrictive testing criteria.  https://twitter.com/AmeshAA/status/1248072496689152001 …,[],['https://twitter.com/AmeshAA/status/1248072496689152001'],[],0,0,0,[],[],https://twitter.com/thisismash/status/1248097976398086144,False,https://twitter.com/AmeshAA/status/1248072496689152001,0,Washington DC,,,,,,"[{'user_id': '17170195', 'username': 'thisismash'}]",,,,
1248097887638024192,1248031484532928514,1586404699000,2020-04-08,20:58:19,PDT,1215197402619097088,syvered1,syvered,,You’re the one that’s ripe.   Mail-in ballots ARE SAFE and they TOTALLY WORK.,['realdonaldtrump'],[],[],0,0,0,[],[],https://twitter.com/syvered1/status/1248097887638024192,False,,0,Washington DC,,,,,,"[{'user_id': '1215197402619097088', 'username': 'syvered1'}, {'user_id': '25073877', 'username': 'realDonaldTrump'}]",,,,
1248097834123001856,1248097834123001856,1586404686000,2020-04-08,20:58:06,PDT,1917731,thehill,The Hill,,Poll: Biden leads Trump by 8 points nationally  http://hill.cm/lu7MqlQ  pic.twitter.com/u9XTpArXp6,[],['http://hill.cm/lu7MqlQ'],['https://pbs.twimg.com/media/EVIiXJqWAAU9lAG.jpg'],116,95,501,[],[],https://twitter.com/thehill/status/1248097834123001856,False,,0,Washington DC,,,,,,"[{'user_id': '1917731', 'username': 'thehill'}]",,,,
1248097815877824512,1247983438126252033,1586404682000,2020-04-08,20:58:02,PDT,2358457956,uskiwiblend,Belinda,,So yet again trump gets a pass,['realtuckfrumper'],[],[],0,0,0,[],[],https://twitter.com/uskiwiblend/status/1248097815877824512,False,,0,Washington DC,,,,,,"[{'user_id': '2358457956', 'username': 'uskiwiblend'}, {'user_id': '55060090', 'username': 'realTuckFrumper'}]",,,,
1248097786844917760,1247919377049096192,1586404675000,2020-04-08,20:57:55,PDT,15842810,hal4,Hal4,,@DNC you paying attention? We are looking down the barrel of Trump landslide and this is ALL your doing.,"['ppollingnumbers', 'dnc']",[],[],0,0,0,[],[],https://twitter.com/Hal4/status/1248097786844917760,False,,0,Washington DC,,,,,,"[{'user_id': '15842810', 'username': 'Hal4'}, {'user_id': '4432916014', 'username': 'PpollingNumbers'}, {'user_id': '722793491059769344', 'username': 'DNC'}]",,,,
1248097691323727877,1248097691323727877,1586404652000,2020-04-08,20:57:32,PDT,1213623457,ubco2,Tanya Chalupa,,Donald Trump sends 200 ventilators to the UK after London's plea  https://mol.im/a/8198351  via @MailOnline,['mailonline'],['https://mol.im/a/8198351'],[],0,0,0,[],[],https://twitter.com/ubco2/status/1248097691323727877,False,,0,Washington DC,,,,,,"[{'user_id': '1213623457', 'username': 'ubco2'}, {'user_id': '15438913', 'username': 'MailOnline'}]",,,,
1248097673179086848,1248072110779621380,1586404648000,2020-04-08,20:57:28,PDT,860697080,nancymax5,Nancy Morris,,No one except for Fox cult members will believe Barr’s bullshit comments. Everything being said by this administration is about opening it all back up because they are worried Trump will lose in November. They don’t care about people dying only Trump bring re-elected. @FoxNews,"['mattzap', 'foxnews']",[],[],1,1,1,[],[],https://twitter.com/Nancymax5/status/1248097673179086848,False,,0,Washington DC,,,,,,"[{'user_id': '860697080', 'username': 'Nancymax5'}, {'user_id': '23332846', 'username': 'mattzap'}, {'user_id': '1367531', 'username': 'FoxNews'}]",,,,
1248097645308137472,1247689002397786112,1586404641000,2020-04-08,20:57:21,PDT,2358457956,uskiwiblend,Belinda,,Why does he keep putting people he doesn’t know in important positions?,"['trumpmustgo9', 'rosebeckley', 'realdonaldtrump']",[],[],1,0,0,[],[],https://twitter.com/uskiwiblend/status/1248097645308137472,False,,0,Washington DC,,,,,,"[{'user_id': '2358457956', 'username': 'uskiwiblend'}, {'user_id': '922286996', 'username': 'TrumpMustGo9'}, {'user_id': '891504580600705028', 'username': 'RoseBeckley'}, {'user_id': '25073877', 'username': 'realDonaldTrump'}]",,,,
1248097613464961024,1248097613464961024,1586404634000,2020-04-08,20:57:14,PDT,18956073,dcexaminer,Washington Examiner,,"MSNBC talking heads agreed that @BernieSanders’ decision is a “worst-case” scenario for @realDonaldTrump. 

@BecketAdams says these people are nuts if they think Trump is more afraid of Biden's murky message over a left-wing populist and his fanatic fans.
 https://washex.am/3e56NDO ","['berniesanders', 'realdonaldtrump', 'becketadams']",['https://washex.am/3e56NDO'],[],9,3,13,[],[],https://twitter.com/dcexaminer/status/1248097613464961024,False,,0,Washington DC,,,,,,"[{'user_id': '18956073', 'username': 'dcexaminer'}, {'user_id': '216776631', 'username': 'BernieSanders'}, {'user_id': '25073877', 'username': 'realDonaldTrump'}, {'user_id': '454119389', 'username': 'BecketAdams'}]",,,,
1248097582028476418,1247927816865214464,1586404626000,2020-04-08,20:57:06,PDT,1011673074490474496,rocessglenn,Glenn Rocess,,"So I guess you’ll be happy to have four more years of Trump, who’s “joked” 27 times about staying on longer than two terms.

Hey, but who cares if he turns the US into a dictatorship? At least you can tell your kids you voted your conscience, huh?","['ks_woke', 'ft_mc_wac', 'bayorugaje', 'mkbowyer']",[],[],1,0,0,[],[],https://twitter.com/RocessGlenn/status/1248097582028476418,False,,0,Washington DC,,,,,,"[{'user_id': '1011673074490474496', 'username': 'RocessGlenn'}, {'user_id': '1084578900129263618', 'username': 'ks_woke'}, {'user_id': '1098307189893038080', 'username': 'Ft_mc_WAC'}, {'user_id': '967530788', 'username': 'bayorugaje'}, {'user_id': '33746146', 'username': 'mkbowyer'}]",,,,
1248097572058730498,1248097572058730498,1586404624000,2020-04-08,20:57:04,PDT,438624109,zerosteps,Rosemary Ciotti,,"Yale psychiatrist Bandy Lee: Trump's ""deadly"" briefings display ""anti-human"" psychology   https://www.salon.com/2020/04/08/yale-psychiatrist-bandy-lee-trumps-deadly-briefings-display-anti-human-psychology/ …",[],['https://www.salon.com/2020/04/08/yale-psychiatrist-bandy-lee-trumps-deadly-briefings-display-anti-human-psychology/'],[],0,0,0,[],[],https://twitter.com/ZeroSteps/status/1248097572058730498,False,,0,Washington DC,,,,,,"[{'user_id': '438624109', 'username': 'ZeroSteps'}]",,,,
1248097508007395329,1248038163429425154,1586404609000,2020-04-08,20:56:49,PDT,34860936,gemluvr257,TryingNotToBeAngry,,"We need to fight together, to stop hackable voting machines, or Trump will be re-elected. We don’t have a fighting chance when our votes can be hacked & changed. I am praying for resisters to help find a solution. We can’t do another 4 or more years! Our lives don’t matter to him","['paulstevesamuel', 'grannyg310', 'joebiden', 'jennychon1']",[],[],1,0,1,[],[],https://twitter.com/gemluvr257/status/1248097508007395329,False,,0,Washington DC,,,,,,"[{'user_id': '34860936', 'username': 'gemluvr257'}, {'user_id': '1148235738535911425', 'username': 'PaulSteveSamuel'}, {'user_id': '712046398489890818', 'username': 'GrannyG310'}, {'user_id': '939091', 'username': 'JoeBiden'}, {'user_id': '2371053578', 'username': 'JennyChon1'}]",,,,
1248097471429054464,1248021198627311619,1586404600000,2020-04-08,20:56:40,PDT,163618333,hidefmessage,HDM,,"The argument is he’s is less racist and islamaphobic than Trump. I don’t think Mahdi is saying Biden won’t also have racist and anti-Muslim policies. 

That said, I think it’s understandable to walk away from a choice of being stabbed by short knife or a long knife.","['nettiepearl01', 'mehdirhasan', 'ricleal']",[],[],0,1,1,[],[],https://twitter.com/hidefmessage/status/1248097471429054464,False,,0,Washington DC,,,,,,"[{'user_id': '163618333', 'username': 'hidefmessage'}, {'user_id': '2320216189', 'username': 'NettiePearl01'}, {'user_id': '130557513', 'username': 'mehdirhasan'}, {'user_id': '30064622', 'username': 'ricleal'}]",,,,
1248097436666478592,1248031484532928514,1586404592000,2020-04-08,20:56:32,PDT,3018850448,32jim2,VOTE BY MAIL IS THE WAY TO GO,,Maybe someone erased them,"['patricknova6', 'realdonaldtrump']",[],[],0,0,0,[],[],https://twitter.com/32jim2/status/1248097436666478592,False,,0,Washington DC,,,,,,"[{'user_id': '3018850448', 'username': '32jim2'}, {'user_id': '1214244905985269760', 'username': 'PatrickNova6'}, {'user_id': '25073877', 'username': 'realDonaldTrump'}]",,,,
1248097430844764160,1248097430844764160,1586404590000,2020-04-08,20:56:30,PDT,751800040465641473,thedavidbrunson,David Brunson,,@realDonaldTrump please hit the Obama Bat Signal...America needs him. @matthewjdowd @StephenKing @amyklobuchar @HillaryClinton @BarackObama @GStephanopoulos @gtconway3d pic.twitter.com/oSaeQU9pPg,"['realdonaldtrump', 'matthewjdowd', 'stephenking', 'amyklobuchar', 'hillaryclinton', 'barackobama', 'gstephanopoulos', 'gtconway3d']",[],['https://pbs.twimg.com/media/EVIh_Q-UwAcR-ht.jpg'],0,0,0,[],[],https://twitter.com/TheDavidBrunson/status/1248097430844764160,False,,0,Washington DC,,,,,,"[{'user_id': '751800040465641473', 'username': 'TheDavidBrunson'}, {'user_id': '25073877', 'username': 'realDonaldTrump'}, {'user_id': '288363743', 'username': 'matthewjdowd'}, {'user_id': '2233154425', 'username': 'StephenKing'}, {'user_id': '33537967', 'username': 'amyklobuchar'}, {'user_id': '1339835893', 'username': 'HillaryClinton'}, {'user_id': '813286', 'username': 'BarackObama'}, {'user_id': '17074440', 'username': 'GStephanopoulos'}, {'user_id': '471677441', 'username': 'gtconway3d'}]",,,,
1248097349999702023,1248097349999702023,1586404571000,2020-04-08,20:56:11,PDT,27699644,julianborger,Julian Borger,,"The WHO has become Trump's latest scapegoat for the coronavirus toll in the US.  But most public health experts say the WHO is not the problem.

 https://www.theguardian.com/world/2020/apr/08/world-health-organization-coronavirus-donald-trump …",[],['https://www.theguardian.com/world/2020/apr/08/world-health-organization-coronavirus-donald-trump'],[],1,8,6,[],[],https://twitter.com/julianborger/status/1248097349999702023,False,,0,Washington DC,,,,,,"[{'user_id': '27699644', 'username': 'julianborger'}]",,,,
1248097312745967616,1248097312745967616,1586404562000,2020-04-08,20:56:02,PDT,118583769,idrewit,“Well Shit”,,I need @NYGovCuomo to run for president.... the way he’s taking charge of this crisis && still able to be relatable.... He’s probably the only who can beat Trump  https://twitter.com/cuomoprimetime/status/1248062964588052483 …,['nygovcuomo'],['https://twitter.com/cuomoprimetime/status/1248062964588052483'],[],0,2,2,[],[],https://twitter.com/iDREWit/status/1248097312745967616,False,https://twitter.com/CuomoPrimeTime/status/1248062964588052483,0,Washington DC,,,,,,"[{'user_id': '118583769', 'username': 'iDREWit'}, {'user_id': '232268199', 'username': 'NYGovCuomo'}]",,,,
1248097252159062016,1248031484532928514,1586404548000,2020-04-08,20:55:48,PDT,3018850448,32jim2,VOTE BY MAIL IS THE WAY TO GO,,"That's ""Richmans Bone Spurs"" and they dissolve after you reach the age of too old to draft. It must have hurt in college for Capt of the basket ball team(Trump) to play with those spurs.","['patricknova6', 'realdonaldtrump']",[],[],0,0,2,[],[],https://twitter.com/32jim2/status/1248097252159062016,False,,0,Washington DC,,,,,,"[{'user_id': '3018850448', 'username': '32jim2'}, {'user_id': '1214244905985269760', 'username': 'PatrickNova6'}, {'user_id': '25073877', 'username': 'realDonaldTrump'}]",,,,
1248097204834877447,1248007233910132736,1586404536000,2020-04-08,20:55:36,PDT,2451498509,eford17451,Edward Ford,,"Yet, we have over 14600+ deaths compared to 13,000 which would equal 1,600 more deaths on the watch of Trump. Math can’t be his strength and I dislike math to the fullest. Wow!  pic.twitter.com/klyZiFnGsZ","['ronaldklain', 'famman93', 'barackobama']",[],[],0,0,0,[],[],https://twitter.com/EFord17451/status/1248097204834877447,False,,1,Washington DC,,,,,,"[{'user_id': '2451498509', 'username': 'EFord17451'}, {'user_id': '248884036', 'username': 'RonaldKlain'}, {'user_id': '713438895879372800', 'username': 'famman93'}, {'user_id': '813286', 'username': 'BarackObama'}]",,,,
1248097108735021058,1247983314859962371,1586404513000,2020-04-08,20:55:13,PDT,938252502373462017,real_alincoln,Abraham Lincoln,,Fuck them all. They're all lost.,"['joelockhart', 'realdonaldtrump']",[],[],0,0,1,[],[],https://twitter.com/Real_ALincoln/status/1248097108735021058,False,,0,Washington DC,,,,,,"[{'user_id': '938252502373462017', 'username': 'Real_ALincoln'}, {'user_id': '101816065', 'username': 'joelockhart'}, {'user_id': '25073877', 'username': 'realDonaldTrump'}]",,,,
1248097084126801921,1247935063456505856,1586404508000,2020-04-08,20:55:08,PDT,3038941520,amaraelpis,AmaraElpis,,"I'm never concerned what stupid people do to themselves, only those they effect with their stupidity.
This administration sh*t the bed so hard, anyone could look"" better.
If Trump wins again... I will never forgive this country.  pic.twitter.com/mmKRfZMsZT","['riceotaku', 'sarahsalcedo', 'joebiden']",[],[],0,0,2,[],[],https://twitter.com/AmaraElpis/status/1248097084126801921,False,,1,Washington DC,,,,,,"[{'user_id': '3038941520', 'username': 'AmaraElpis'}, {'user_id': '92103730', 'username': 'riceOtaku'}, {'user_id': '15618780', 'username': 'SarahSalcedo'}, {'user_id': '939091', 'username': 'JoeBiden'}]",,,,
1248096983513853954,1248060783407312896,1586404484000,2020-04-08,20:54:44,PDT,62984708,galen_live,Heather,,worse than Trump?  How do you figure?,"['_mic_hael_', 'mediaoracle']",[],[],1,0,0,[],[],https://twitter.com/gALeN_Live/status/1248096983513853954,False,,0,Washington DC,,,,,,"[{'user_id': '62984708', 'username': 'gALeN_Live'}, {'user_id': '3429263495', 'username': '_Mic_hael_'}, {'user_id': '14686778', 'username': 'MediaOracle'}]",,,,
1248096952505348096,1248038583723683841,1586404476000,2020-04-08,20:54:36,PDT,713455876439285760,demigorn,💻🏴‍☠️The I.T. Pirate🎮☠,,"Lots of numbers, still a bad week but, things are looking up as we're seeing an effect from the #PhysicalDistancing that's going on.","['thetoknsquirrel', 'mike_pence', 'realdonaldtrump']",[],[],1,0,2,['#physicaldistancing'],[],https://twitter.com/Demigorn/status/1248096952505348096,False,,0,Washington DC,,,,,,"[{'user_id': '713455876439285760', 'username': 'Demigorn'}, {'user_id': '1032163948861304832', 'username': 'TheToknSquirrel'}, {'user_id': '22203756', 'username': 'Mike_Pence'}, {'user_id': '25073877', 'username': 'realDonaldTrump'}]",,,,
1248096937552875522,1247914779949166597,1586404473000,2020-04-08,20:54:33,PDT,296606634,renegade_blog,GetYourFreakOnElliot,,You seem to be using circular logic. 1. You said that your write-in will just mean it will go to the democratic party nominee (Biden) 2. This means you would be voting for Biden anyways (by your logic) but you have room to chastise me. lmfao. Good luck voting for Trump though!  pic.twitter.com/SYJdWhF9o0,"['joshbreezzyy', 'ryanjennens', 'sendcats', 'spanksmcbooty']",[],[],1,0,0,[],[],https://twitter.com/Renegade_Blog/status/1248096937552875522,False,,1,Washington DC,,,,,,"[{'user_id': '296606634', 'username': 'Renegade_Blog'}, {'user_id': '799657597251022848', 'username': 'JoshBreezzyy'}, {'user_id': '427154598', 'username': 'RyanJennens'}, {'user_id': '31179339', 'username': 'sendcats'}, {'user_id': '1666438470', 'username': 'SpanksMcbooty'}]",,,,
