id,conversation_id,created_at,date,time,timezone,user_id,username,name,place,tweet,mentions,urls,photos,replies_count,retweets_count,likes_count,hashtags,cashtags,link,retweet,quote_url,video,near,geo,source,user_rt_id,user_rt,retweet_id,reply_to,retweet_date,translate,trans_src,trans_dest
1248109252096319488,1248083692444098566,1586407409000,2020-04-08,21:43:29,PDT,224439326,ronbobius,House Atreides,,"My 78 year old mother stood in line with a lung illness for two hours in Florida during the Covid outbreak a couple of weeks ago and SHE voted.

Stop thinking about how we are voting Biden in, and more how we are voting Trump the fuck out.

We lost but sitting at home is NOT OK.",['kylekulinski'],[],[],0,0,1,[],[],https://twitter.com/ronbobius/status/1248109252096319488,False,,0,Washington DC,,,,,,"[{'user_id': '224439326', 'username': 'ronbobius'}, {'user_id': '143104075', 'username': 'KyleKulinski'}]",,,,
1248109203161407488,1248075834637729793,1586407397000,2020-04-08,21:43:17,PDT,15964748,vikkids,vikkids,,"Trump is a bum. He wants all the credit and refuses to accept the blame.  America wants his inactions investigated. How many deaths could have been avoided had Trump done something other than golf! When America needed a leader, we ended up with a caboose.","['nightlypolitics', 'realdonaldtrump']",[],[],0,0,0,[],[],https://twitter.com/vikkids/status/1248109203161407488,False,,0,Washington DC,,,,,,"[{'user_id': '15964748', 'username': 'vikkids'}, {'user_id': '1006096223596511244', 'username': 'NightlyPolitics'}, {'user_id': '25073877', 'username': 'realDonaldTrump'}]",,,,
1248109192822640640,1248109192822640640,1586407394000,2020-04-08,21:43:14,PDT,2348025102,justjakedc,jake,,"People keep mentioning how Trump has stacked the Supreme Court with conservative justices, but the larger story is what he’s also been doing to the federal courts.  https://www.vox.com/policy-and-politics/2019/12/9/20962980/trump-supreme-court-federal-judges …",[],['https://www.vox.com/policy-and-politics/2019/12/9/20962980/trump-supreme-court-federal-judges'],[],1,1,6,[],[],https://twitter.com/justjakedc/status/1248109192822640640,False,,0,Washington DC,,,,,,"[{'user_id': '2348025102', 'username': 'justjakedc'}]",,,,
1248109161914576897,1247914464319504385,1586407387000,2020-04-08,21:43:07,PDT,825527468450668548,davster16,Davi Kallman,,This is beyond tacky. I thought this was fake at first. Shame on you.,['realdonaldtrump'],[],[],0,0,0,[],[],https://twitter.com/Davster16/status/1248109161914576897,False,,0,Washington DC,,,,,,"[{'user_id': '825527468450668548', 'username': 'Davster16'}, {'user_id': '25073877', 'username': 'realDonaldTrump'}]",,,,
1248109143107309569,1248031484532928514,1586407383000,2020-04-08,21:43:03,PDT,30041043,pearljman,Matthew Hirst,,"Read every study out there. There is not a fraud problem with mail in voting. What's more offensive is the people that voted whether or not people can vote remotely, voted on it remotely. Do you understand the absurdity of the GOP?",['realdonaldtrump'],[],[],0,0,0,[],[],https://twitter.com/Pearljman/status/1248109143107309569,False,,0,Washington DC,,,,,,"[{'user_id': '30041043', 'username': 'Pearljman'}, {'user_id': '25073877', 'username': 'realDonaldTrump'}]",,,,
1248109097486036993,1247690496555847682,1586407372000,2020-04-08,21:42:52,PDT,825015891184193538,beverly79943415,Beverly S,,The blind leading the blind.....,"['chuckgrassley', 'realdonaldtrump']",[],[],0,0,0,[],[],https://twitter.com/Beverly79943415/status/1248109097486036993,False,,0,Washington DC,,,,,,"[{'user_id': '825015891184193538', 'username': 'Beverly79943415'}, {'user_id': '10615232', 'username': 'ChuckGrassley'}, {'user_id': '25073877', 'username': 'realDonaldTrump'}]",,,,
1248109077080793089,1247919539809128451,1586407367000,2020-04-08,21:42:47,PDT,1289341652,redamin_red,red,,Biden is a homosexual lizard! We all know this!,['realdonaldtrump'],[],[],0,0,0,[],[],https://twitter.com/redamin_red/status/1248109077080793089,False,,0,Washington DC,,,,,,"[{'user_id': '1289341652', 'username': 'redamin_red'}, {'user_id': '25073877', 'username': 'realDonaldTrump'}]",,,,
1248109072924258305,1248105047956656128,1586407366000,2020-04-08,21:42:46,PDT,2369819532,jbw1837,Fairview,,"From a man whose career is on it's last legs. 

He's like Lindey Graham & the shark analogy. His shark is hannity & graham's is trump.",['covidperspectiv'],[],[],0,0,0,[],[],https://twitter.com/jbw1837/status/1248109072924258305,False,,0,Washington DC,,,,,,"[{'user_id': '2369819532', 'username': 'jbw1837'}, {'user_id': '1225135593937465344', 'username': 'covidperspectiv'}]",,,,
1248108950358306818,1248031484532928514,1586407337000,2020-04-08,21:42:17,PDT,463066213,arniekappeler,Arnie Kappeler,,"I’m going to vote mail-in, just for kicks.  Let’s see what happens.",['realdonaldtrump'],[],[],0,0,0,[],[],https://twitter.com/ArnieKappeler/status/1248108950358306818,False,,0,Washington DC,,,,,,"[{'user_id': '463066213', 'username': 'ArnieKappeler'}, {'user_id': '25073877', 'username': 'realDonaldTrump'}]",,,,
1248108948407844864,1248043551855759365,1586407336000,2020-04-08,21:42:16,PDT,945343096882999296,jay_misener1,Jay,,Do this for four more years of trump,"['susysucks', 'guacamomole']",[],[],0,0,0,[],[],https://twitter.com/jay_misener1/status/1248108948407844864,False,,0,Washington DC,,,,,,"[{'user_id': '945343096882999296', 'username': 'jay_misener1'}, {'user_id': '2754227116', 'username': 'susysucks'}, {'user_id': '2758988514', 'username': 'guacamomole'}]",,,,
1248108848319287297,1248108848319287297,1586407312000,2020-04-08,21:41:52,PDT,130557513,mehdirhasan,Mehdi Hasan,,"""A majority of Americans - 55% - now say the federal government has done a poor job preventing the spread of the disease in the United States, up 8 points in about a week. And 52% say they disapprove of the way Trump is handling the outbreak."" 

Finally.
 https://www.cnn.com/2020/04/08/politics/donald-trump-coronavirus/index.html …",[],['https://www.cnn.com/2020/04/08/politics/donald-trump-coronavirus/index.html'],[],29,76,336,[],[],https://twitter.com/mehdirhasan/status/1248108848319287297,False,,0,Washington DC,,,,,,"[{'user_id': '130557513', 'username': 'mehdirhasan'}]",,,,
1248108840995913734,1248107440295399432,1586407311000,2020-04-08,21:41:51,PDT,377625161,melissaemmal,Melissa Emmal,,Following his gut instincts or anything will be a death sentence for many many people. Let’s go ahead and follow science instead.,"['lupecolon', 'realdonaldtrump']",[],[],0,0,0,[],[],https://twitter.com/MelissaEmmal/status/1248108840995913734,False,,0,Washington DC,,,,,,"[{'user_id': '377625161', 'username': 'MelissaEmmal'}, {'user_id': '373806014', 'username': 'LupeColon'}, {'user_id': '25073877', 'username': 'realDonaldTrump'}]",,,,
1248108793147412485,1248108793147412485,1586407299000,2020-04-08,21:41:39,PDT,1153734614755749889,libertyandprog,Liberty & Progress Federation,,To angry Bernie supporters: we understand wholeheartedly your frustration with the system. But we can’t stress this enough DON’T NOT VOTE. We would rather you vote for Trump than not vote at all. Because as rigged as the system may be we can’t change it if we don’t show we care.,[],[],[],0,0,1,[],[],https://twitter.com/LibertyAndProg/status/1248108793147412485,False,,0,Washington DC,,,,,,"[{'user_id': '1153734614755749889', 'username': 'LibertyAndProg'}]",,,,
1248108792300146688,1248101445796278272,1586407299000,2020-04-08,21:41:39,PDT,803801574,kevinmcgilly,Kevin McGilly,,"Hallie, let me explain. There are three ways you can help Trump win re-election: vote for Trump, don’t vote, or vote for someone other than Biden.
If you would like to see Trump defeated and our 250 year-old democracy continue, vote for Biden.
Clear now?","['tomasitox_', 'hail_g', 'drsagger']",[],[],2,0,0,[],[],https://twitter.com/KevinMcGilly/status/1248108792300146688,False,,0,Washington DC,,,,,,"[{'user_id': '803801574', 'username': 'KevinMcGilly'}, {'user_id': '1226748787110092800', 'username': 'Tomasitox_'}, {'user_id': '586677593', 'username': 'hail_g'}, {'user_id': '955109400091426816', 'username': 'DrSagger'}]",,,,
1248108751351095296,1248108751351095296,1586407289000,2020-04-08,21:41:29,PDT,52965562,mikelotus,"Mike ""moo Nunes"" Confoy 🇺🇸 ≠ 🇷🇺",,Colorado Democrat believes Trump awarded ventilators as political favor to vulnerable GOP senator  https://www.cnn.com/2020/04/08/politics/degette-gardner-trump-ventilators-favor/index.html …,[],['https://www.cnn.com/2020/04/08/politics/degette-gardner-trump-ventilators-favor/index.html'],[],0,0,0,[],[],https://twitter.com/mikelotus/status/1248108751351095296,False,,0,Washington DC,,,,,,"[{'user_id': '52965562', 'username': 'mikelotus'}]",,,,
1248108702718189568,1247920239045681159,1586407278000,2020-04-08,21:41:18,PDT,756149201004662786,theunidev,uni,,"Trump has 58 allegations of sexual assault. Trump has been caught making sexist and racist remarks. Trump insults his peers and news media every day. Trump lies or misled his followers 10,796 times in his first 869 days in office. And this is a man of God to you?","['maddywalkedaway', 'talbertswan', 'realdonaldtrump']",[],[],0,0,0,[],[],https://twitter.com/TheUniDev/status/1248108702718189568,False,,0,Washington DC,,,,,,"[{'user_id': '756149201004662786', 'username': 'TheUniDev'}, {'user_id': '1127397570223968256', 'username': 'MaddyWalkedAway'}, {'user_id': '16873455', 'username': 'TalbertSwan'}, {'user_id': '25073877', 'username': 'realDonaldTrump'}]",,,,
1248108679615746049,1247914464319504385,1586407272000,2020-04-08,21:41:12,PDT,37698363,turbokia,PNW,,"#thetrumppresidencyisover 

'nuff said",['realdonaldtrump'],[],[],0,0,0,['#thetrumppresidencyisover'],[],https://twitter.com/TurboKia/status/1248108679615746049,False,,0,Washington DC,,,,,,"[{'user_id': '37698363', 'username': 'TurboKia'}, {'user_id': '25073877', 'username': 'realDonaldTrump'}]",,,,
1248108646946439174,1248108646946439174,1586407264000,2020-04-08,21:41:04,PDT,1917731,thehill,The Hill,,"Dennis Quaid praises Trump handling of coronavirus response: “We see him on television every day, he’s involved""  http://hill.cm/SMVQDLq  pic.twitter.com/Qf0O4ZVhUD",[],['http://hill.cm/SMVQDLq'],['https://pbs.twimg.com/media/EVIsMiAWsAI0V97.jpg'],235,81,267,[],[],https://twitter.com/thehill/status/1248108646946439174,False,,0,Washington DC,,,,,,"[{'user_id': '1917731', 'username': 'thehill'}]",,,,
1248108599626219520,1248108599626219520,1586407253000,2020-04-08,21:40:53,PDT,47541189,toddxz,todd anderson,,Exponential Threat  https://youtu.be/bkMwvmJLnc0  via @YouTube trump add #trumplague,['youtube'],['https://youtu.be/bkMwvmJLnc0'],[],0,0,0,['#trumplague'],[],https://twitter.com/toddxz/status/1248108599626219520,False,,0,Washington DC,,,,,,"[{'user_id': '47541189', 'username': 'toddxz'}, {'user_id': '10228272', 'username': 'YouTube'}]",,,,
1248108278304763905,1247914464319504385,1586407176000,2020-04-08,21:39:36,PDT,30041043,pearljman,Matthew Hirst,,"But, how's your Facebook rankings?",['realdonaldtrump'],[],[],0,0,0,[],[],https://twitter.com/Pearljman/status/1248108278304763905,False,,0,Washington DC,,,,,,"[{'user_id': '30041043', 'username': 'Pearljman'}, {'user_id': '25073877', 'username': 'realDonaldTrump'}]",,,,
1248108203021234176,1248081461154021377,1586407158000,2020-04-08,21:39:18,PDT,1169455352573616128,nwsteven83,Steve🏳️‍🌈🇺🇸,,A vote for Green is a vote for 4 more years of Trump. Period.,"['saminnature', 'bourgeoisalien', 'ninaturner']",[],[],1,0,0,[],[],https://twitter.com/NWSteven83/status/1248108203021234176,False,,0,Washington DC,,,,,,"[{'user_id': '1169455352573616128', 'username': 'NWSteven83'}, {'user_id': '1231799364063916033', 'username': 'Saminnature'}, {'user_id': '2396910715', 'username': 'bourgeoisalien'}, {'user_id': '188793260', 'username': 'ninaturner'}]",,,,
1248108190056636418,1248108190056636418,1586407155000,2020-04-08,21:39:15,PDT,1220263710616252416,surfingblue2020,Erica Lynn🦋,,"Trump’s worst lie to date... 

""I do solemnly swear that I will faithfully execute the Office of President of the United States, and will to the best of my Ability, preserve, protect and defend the Constitution of the United States.""",[],[],[],0,5,17,[],[],https://twitter.com/SurfingBlue2020/status/1248108190056636418,False,,0,Washington DC,,,,,,"[{'user_id': '1220263710616252416', 'username': 'SurfingBlue2020'}]",,,,
1248108155550253056,1248105631413932032,1586407147000,2020-04-08,21:39:07,PDT,818838535046209537,ladyonfyre,Ladyfyre,,Math.  Specifically math theory.  It is almost impossible for someone to lose the overall primary and win the general election. Everytime someone says Biden will lose to Trump but Bernie would have won it shows me their reasoning is flawed.,['electricfire89'],[],[],0,0,0,[],[],https://twitter.com/Ladyonfyre/status/1248108155550253056,False,,0,Washington DC,,,,,,"[{'user_id': '818838535046209537', 'username': 'Ladyonfyre'}, {'user_id': '58614872', 'username': 'electricfire89'}]",,,,
1248108153562161152,1248108153562161152,1586407147000,2020-04-08,21:39:07,PDT,626131422,spmiles42,Stephen Miles,,Remember when you were gonna be able to be tested all over the place? I remember all those CEOs standing with Trump swearing it was about to happen. Lies. Lies. Lies. Lies. Lies. Lies. And failure after failure after failure.  https://twitter.com/npratc/status/1247988083376549888 …,[],['https://twitter.com/npratc/status/1247988083376549888'],[],0,3,3,[],[],https://twitter.com/SPMiles42/status/1248108153562161152,False,https://twitter.com/npratc/status/1247988083376549888,0,Washington DC,,,,,,"[{'user_id': '626131422', 'username': 'SPMiles42'}]",,,,
1248108114060234752,1248108114060234752,1586407137000,2020-04-08,21:38:57,PDT,621126983,temporary_times,J. W.,,@realDonaldTrump @TeamTrump fulfill your promise and make marijuana federally legal now or by the end of the #CCPVirus #coronavirus crisis. This will create a new gold rush across the nation and guarantee a V shaped recovery and your reelection. #Marijuanawinthewar #weed,"['realdonaldtrump', 'teamtrump']",[],[],0,0,0,"['#ccpvirus', '#coronavirus', '#marijuanawinthewar', '#weed']",[],https://twitter.com/Temporary_Times/status/1248108114060234752,False,,0,Washington DC,,,,,,"[{'user_id': '621126983', 'username': 'Temporary_Times'}, {'user_id': '25073877', 'username': 'realDonaldTrump'}, {'user_id': '729676086632656900', 'username': 'TeamTrump'}]",,,,
1248108107684773889,1248108107684773889,1586407136000,2020-04-08,21:38:56,PDT,56866864,hulaval,valerie jean-lee,,@kenolin1 I completely agree! @realDonaldTrump worst disgraceful delusional disgusting murderer cheater criminal liar 🤥 no morals or respect or accountability! #ImpeachedForever #bebestmyass https://twitter.com/kenolin1/status/1248089905609289728 …,"['kenolin1', 'realdonaldtrump']",['https://twitter.com/kenolin1/status/1248089905609289728'],[],0,0,0,"['#impeachedforever', '#bebestmyass']",[],https://twitter.com/hulaval/status/1248108107684773889,False,https://twitter.com/kenolin1/status/1248089905609289728,0,Washington DC,,,,,,"[{'user_id': '56866864', 'username': 'hulaval'}, {'user_id': '164679813', 'username': 'kenolin1'}, {'user_id': '25073877', 'username': 'realDonaldTrump'}]",,,,
1248108105411579904,1247730313092046849,1586407135000,2020-04-08,21:38:55,PDT,109112780,vkrivacsyjr,Vincent Krivacsy Jr,,"Exactly! 

Mr President. FIRE BIRX AND FAUCI! NOW!","['dineshdsouza', 'realdonaldtrump']",[],[],0,0,1,[],[],https://twitter.com/VkrivacsyJr/status/1248108105411579904,False,,0,Washington DC,,,,,,"[{'user_id': '109112780', 'username': 'VkrivacsyJr'}, {'user_id': '91882544', 'username': 'DineshDSouza'}, {'user_id': '25073877', 'username': 'realDonaldTrump'}]",,,,
1248108056061378563,1247962546658660352,1586407123000,2020-04-08,21:38:43,PDT,3635256321,king0fanatolia,Fritzi Gonzalez🌹,,"""Taking a shit in the morning""= a vote for Trump
""Attending grandma's birthday party"" = a vote for Trump
""Eating raisin bread"" = a vote for Trump
""Buying cookies from the girl scouts""= a vote for Trump

Help me out guys, let's keep it going",['sethgs'],[],[],1,0,8,[],[],https://twitter.com/King0fAnatolia/status/1248108056061378563,False,,0,Washington DC,,,,,,"[{'user_id': '3635256321', 'username': 'King0fAnatolia'}, {'user_id': '19214688', 'username': 'sethgs'}]",,,,
1248107888515543040,1247980716299882497,1586407084000,2020-04-08,21:38:04,PDT,182998650,dailyvignette,Toni Johnson,,"Vote blue, no matter who, or we’ll be stuck with Trump for another four very long years. I don’t know if we could survive that.","['davidhogg111', 'joebiden']",[],[],0,0,0,[],[],https://twitter.com/dailyvignette/status/1248107888515543040,False,,0,Washington DC,,,,,,"[{'user_id': '182998650', 'username': 'dailyvignette'}, {'user_id': '1915033663', 'username': 'davidhogg111'}, {'user_id': '939091', 'username': 'JoeBiden'}]",,,,
1248107871801184257,1248063850546593794,1586407080000,2020-04-08,21:38:00,PDT,34860936,gemluvr257,TryingNotToBeAngry,,"You must be young. I’m old, & I’ve seen more corruption from the Trump Administration than I’ve seen in a lifetime! Hide the truth from yourselves all you want but our Country has lost many lives fighting for political wars than I care to discuss. Grow up!","['officialredside', 'debbie_lemen', 'eve_goes_local', 'politico']",[],[],1,0,0,[],[],https://twitter.com/gemluvr257/status/1248107871801184257,False,,0,Washington DC,,,,,,"[{'user_id': '34860936', 'username': 'gemluvr257'}, {'user_id': '760591629551964160', 'username': 'OfficialRedSide'}, {'user_id': '937320618994950145', 'username': 'debbie_lemen'}, {'user_id': '757769203487281152', 'username': 'eve_goes_local'}, {'user_id': '9300262', 'username': 'politico'}]",,,,
1248107728372973569,1248107728372973569,1586407045000,2020-04-08,21:37:25,PDT,1171084271823609857,liviadrusilla10,Inside The Beltway,,Trump talks Bernie dropping out and Obama's feelings about Joe Biden  https://youtu.be/hvc636KKvcw  via @YouTube,['youtube'],['https://youtu.be/hvc636KKvcw'],[],1,0,1,[],[],https://twitter.com/LiviaDrusilla10/status/1248107728372973569,False,,0,Washington DC,,,,,,"[{'user_id': '1171084271823609857', 'username': 'LiviaDrusilla10'}, {'user_id': '10228272', 'username': 'YouTube'}]",,,,
1248107715051704321,1248047514298843136,1586407042000,2020-04-08,21:37:22,PDT,453313539,donnabrandt50,Donna,,Oh damn.  Now you’re talking.,"['spiritservicesl', 'inevitable_et', 'realdonaldtrump']",[],[],0,0,1,[],[],https://twitter.com/DonnaBrandt50/status/1248107715051704321,False,,0,Washington DC,,,,,,"[{'user_id': '453313539', 'username': 'DonnaBrandt50'}, {'user_id': '1137797617', 'username': 'SpiritServicesL'}, {'user_id': '1886468286', 'username': 'Inevitable_ET'}, {'user_id': '25073877', 'username': 'realDonaldTrump'}]",,,,
1248107685611835392,1248107685611835392,1586407035000,2020-04-08,21:37:15,PDT,31677779,digikatt,DigiKatt Shaw,,"@realDonaldTrump yeah, a real winner... #TrumpTheRealEnemyOfThePeople pic.twitter.com/XBxGE3vx7Q",['realdonaldtrump'],[],['https://pbs.twimg.com/media/EVIrUz2U8AAfzv5.jpg'],0,0,0,['#trumptherealenemyofthepeople'],[],https://twitter.com/DigiKatt/status/1248107685611835392,False,,0,Washington DC,,,,,,"[{'user_id': '31677779', 'username': 'DigiKatt'}, {'user_id': '25073877', 'username': 'realDonaldTrump'}]",,,,
1248107648530219012,1248107648530219012,1586407026000,2020-04-08,21:37:06,PDT,18956073,dcexaminer,Washington Examiner,,"""He knows something that you don't know, that I think I know. But you don't know."" 

@realDonaldTrump thinks there's something @BarackObama knows that everyone else doesn't know, which is why he hasn't endorsed @JoeBiden yet. https://washex.am/3aV7KwB ","['realdonaldtrump', 'barackobama', 'joebiden']",['https://washex.am/3aV7KwB'],[],10,12,19,[],[],https://twitter.com/dcexaminer/status/1248107648530219012,False,,0,Washington DC,,,,,,"[{'user_id': '18956073', 'username': 'dcexaminer'}, {'user_id': '25073877', 'username': 'realDonaldTrump'}, {'user_id': '813286', 'username': 'BarackObama'}, {'user_id': '939091', 'username': 'JoeBiden'}]",,,,
1248107638740545536,1248107638740545536,1586407024000,2020-04-08,21:37:04,PDT,2204112703,reevesdale11,Dale R.,,Acknowledging my bias... this piece makes it nearly impossible to ignore Trump’s failure’s over the past months... and possibly his entire presidency  https://twitter.com/atticus59914029/status/1247713451004375045 …,[],['https://twitter.com/atticus59914029/status/1247713451004375045'],[],0,0,0,[],[],https://twitter.com/reevesdale11/status/1248107638740545536,False,https://twitter.com/Atticus59914029/status/1247713451004375045,0,Washington DC,,,,,,"[{'user_id': '2204112703', 'username': 'reevesdale11'}]",,,,
1248107464710426625,1248107464710426625,1586406982000,2020-04-08,21:36:22,PDT,47541189,toddxz,todd anderson,,‘Admission Of Failure:’ Chris Hayes On Trump Saying Virus Should Soon Be Forgotten | All In | MSNBC - YouTube  https://www.youtube.com/watch?v=t_Yn2j_LDyQ …,[],['https://www.youtube.com/watch?v=t_Yn2j_LDyQ'],[],0,0,0,[],[],https://twitter.com/toddxz/status/1248107464710426625,False,,0,Washington DC,,,,,,"[{'user_id': '47541189', 'username': 'toddxz'}]",,,,
1248107458649825280,1248107458649825280,1586406981000,2020-04-08,21:36:21,PDT,1248104788824403968,jackier20349697,Jackie Robinson,,Donald Trump can assist in the release of rapper A$AP Rocky 🗡️🗡️  pic.twitter.com/1W2nrpFsDn,[],[],['https://pbs.twimg.com/media/EVIrGsVX0AAMwGm.jpg'],0,1,1,[],[],https://twitter.com/JackieR20349697/status/1248107458649825280,False,,0,Washington DC,,,,,,"[{'user_id': '1248104788824403968', 'username': 'JackieR20349697'}]",,,,
1248107333198073856,1248085743630721025,1586406951000,2020-04-08,21:35:51,PDT,15964748,vikkids,vikkids,,Any honorable person would do better job than Trump,['thehill'],[],[],0,0,0,[],[],https://twitter.com/vikkids/status/1248107333198073856,False,,0,Washington DC,,,,,,"[{'user_id': '15964748', 'username': 'vikkids'}, {'user_id': '1917731', 'username': 'thehill'}]",,,,
1248107257050660864,1248098232657477632,1586406933000,2020-04-08,21:35:33,PDT,434634299,rlheinrichs,Rebeccah Heinrichs,,This has to be a defining moment for Trump. He has permitted State to define the ideological problems and DOD to shift to defining and deterring China’s mil adventurism but DT has stuck w/ the narrow trade piece while being conciliatory toward Xi. That shld change.,"['jameshasson20', 'redsteeze']",[],[],2,9,25,[],[],https://twitter.com/RLHeinrichs/status/1248107257050660864,False,,0,Washington DC,,,,,,"[{'user_id': '434634299', 'username': 'RLHeinrichs'}, {'user_id': '880801071052062720', 'username': 'JamesHasson20'}, {'user_id': '393469195', 'username': 'redsteeze'}]",,,,
1248107237387763713,1247281430759079936,1586406928000,2020-04-08,21:35:28,PDT,890256018231480320,_michelangelo__,Michelangelo,,"Yeah, “fanatics” describes you well. 
It’s not a good thing, if you had half a brain to understand it.","['landisholdorfsr', 'justicedankelly', 'realdonaldtrump']",[],[],0,0,0,[],[],https://twitter.com/_Michelangelo__/status/1248107237387763713,False,,0,Washington DC,,,,,,"[{'user_id': '890256018231480320', 'username': '_Michelangelo__'}, {'user_id': '1211759282477158401', 'username': 'LandisHoldorfSr'}, {'user_id': '1133188600823046144', 'username': 'JusticeDanKelly'}, {'user_id': '25073877', 'username': 'realDonaldTrump'}]",,,,
1248107172757725184,1248104611170435080,1586406913000,2020-04-08,21:35:13,PDT,29237261,danohara17,Dan O'Hara,,"I have zero use for ""I told you so's"" or ""lesser of two evils"" talk AT ALL. We've seen the death and destruction Trump has left us with - there should be no question that he needs to be defeated. Let's get this done.
Thanks,
Management",[],[],[],0,0,0,[],[],https://twitter.com/danohara17/status/1248107172757725184,False,,0,Washington DC,,,,,,"[{'user_id': '29237261', 'username': 'danohara17'}]",,,,
1248107170257719297,1248107170257719297,1586406912000,2020-04-08,21:35:12,PDT,2192491880,livinginthegig,PNW_Louise(@🏡)🌊,,"As the Trump-RNC-Koch-Russia disinformation machine ramps up against Biden, read this thread + The Hill article and recall how it operated against HRC to our detriment. Same plot if Bernie was the nominee. 
Don't get played.
Stay focused on winning the WH.
#VoteBlueToSaveAmerica https://twitter.com/SethAbramson/status/1248078651020718080 …",[],['https://twitter.com/SethAbramson/status/1248078651020718080'],[],0,0,1,['#votebluetosaveamerica'],[],https://twitter.com/livingintheGig/status/1248107170257719297,False,https://twitter.com/SethAbramson/status/1248078651020718080,0,Washington DC,,,,,,"[{'user_id': '2192491880', 'username': 'livingintheGig'}]",,,,
1248106931287404544,1248106931287404544,1586406855000,2020-04-08,21:34:15,PDT,782407278011912192,h00rayforstuff,Sweater Weather Underground,,GOP controlled state legislatures can reelect Trump without having any voting in their state and the constitution says that's ok,[],[],[],0,0,3,[],[],https://twitter.com/h00rayforstuff/status/1248106931287404544,False,,0,Washington DC,,,,,,"[{'user_id': '782407278011912192', 'username': 'h00rayforstuff'}]",,,,
1248106815289806853,1248031484532928514,1586406828000,2020-04-08,21:33:48,PDT,2369819532,jbw1837,Fairview,,"What about the fraud in machine voting by hacking
Can't u stand for something that is admirable? Not just a puppet for the #GOP & #MitchMcConnell 
They're using you. You'll be gone while they'll carry on. You're ruining your legacy by being a puppet president, they'll chastise u",['realdonaldtrump'],[],[],0,0,0,"['#gop', '#mitchmcconnell']",[],https://twitter.com/jbw1837/status/1248106815289806853,False,,0,Washington DC,,,,,,"[{'user_id': '2369819532', 'username': 'jbw1837'}, {'user_id': '25073877', 'username': 'realDonaldTrump'}]",,,,
